source,title,description,category,publishedAt
Blick.ch,Susanne Kunz dachte mit zehn Jahren erstmals an eine Diät,"Die ehemalige SRF-Moderatorin Susanne Kunz verrät in Claudia Lässers Talk-Format, warum sie im Alter von zehn Jahren erstmals daran dachte abzunehmen – und welche zwei grossen Wünsche sie noch für die Zukunft hat.",entertainment,2021-05-16T17:07:22Z
BUNTE.de,"ZDF-""Fernsehgarten"": ""Das nehmen wir gleich raus!"" – das stieß Andrea Kiewel sauer auf - BUNTE.de","Hoppala, da entrutscht einer 81-Jährigen vor laufenden Kameras das B-Wort! Da muss ZDF-Moderatorin Andrea Kiewel direkt eingreifen.",entertainment,2021-05-16T13:25:09Z
Www.nau.ch,Prinz Harry schiesst gegen Charles – und kriegt aufs Dach,Prinz Harry sprach von fehlenden Erziehungsfähigkeiten seines Vaters Charles. Nun kriegt Harry von einem scharfen Kritiker selbst aufs Dach.,entertainment,2021-05-16T10:35:54Z
Blick.ch,Dieter Bohlen kann wegen RTL keine anderen TV-Projekte wahrnehmen,"Fans löchern Pop-Titan Dieter Bohlen, wann er nach seinem «DSDS»-Aus endlich wieder auf dem TV-Bildschirm zu sehen sein wird. Wegen Verträgen mit RTL wird das noch eine Weile dauern, sagt er jetzt.",entertainment,2021-05-16T10:19:22Z
Www.nau.ch,Willi Herren (†45): Schwester erfuhr über Journalist von Tod!,"Das wünscht man niemandem. Anna-Maria Herren erfuhr über ein Telefonat mit einem Journalisten, dass ihr Bruder Willi Herren tot ist.",entertainment,2021-05-16T09:50:39Z
20 Minuten,20 Jahre nach Gründung - Geben Bro’Sis ein Comeback?,Vor zwanzig Jahren wurde die Castingband Bro’Sis gegründet. Zum Jubiläum gibts neue Cover-Versionen der Ex-Bandmitglieder Ross Antony und Giovanni Zarella.,entertainment,2021-05-16T09:43:41Z
Watson.ch,Kate Winslet rüpelt doppelt in «Ammonite» und «Mare of Easttown»,Im Kino und auf Sky Show brechen gerade die Kate-Winslet-Festspiele an. Beides ist sehenswert. Auch wenn man so einiges davon schon ein wenig zu kennen glaubt.,entertainment,2021-05-16T09:34:00Z
Telezueri.ch,2 min Vertrauen Sie jetzt Ihrem Herzen - TeleZüri,"Die günstigen Beziehungssterne bieten in dieser Woche ein solides Fundament für gemeinsame Projekte. So können Sie mit anderen Menschen etwas aufbauen, das langfristig Bestand hat. Das Wochenhoroskop vom 17. bis 23. Mai 2021.",entertainment,2021-05-16T08:03:30Z
Schweizer-illustrierte.ch,Grosser Auftritt von Königin Máxima und ihren Töchtern zum 50. Geburtstag - Schweizer Illustrierte,Endlich wieder einmal ein grosser Auftritt der niederländischen Royals! In Amsterdam feierte die ganze Familie den 50. Geburtstag von Königin Máxima vor und packte dazu die schönste Abendgarderobe aus.,entertainment,2021-05-16T06:10:15Z
20 Minuten,Alternativ-Wettbewerb - Rea Garvey gewinnt «Free Eurovision Song Contest»,Irland hat beim Eurovision Song Contest schon sieben Siege geholt. Bei der von Show-Guru Stefan Raab erdachten ESC-Variante läuft es nun ebenfalls ziemlich gut. Die Schweiz allerdings verpasste die Top Ten knapp.,entertainment,2021-05-16T03:17:48Z
Www.nau.ch,Prinz William und Kates Charity-Chef kündigt wegen Meghan,"Jason Knauf, der Charity-Chef von Prinz William und Kate Middleton, kündigt. Brisant: Vor einem Monat wurden seine Mobbing-Vorwürfe gegen Meghan publik.",entertainment,2021-05-15T19:00:41Z
20 Minuten,"David Beckham, Lady Gaga und BTS - Diese Stars sind in der Reunion-Folge von «Friends» dabei",Bald wird das Reunion-Special der Kult-Sitcom «Friends» ausgestrahlt. Das hat HBO nun mit dem ersten Trailer und neuen Details zur Show verkündet.,entertainment,2021-05-15T18:39:45Z
Www.nau.ch,Prinz Charles wollte vor Diana eine andere heiraten,"Prinz Charles und seine Liebesgeschichten sind allgemein bekannt. Doch es gab eine Frau, die er vor Prinzessin Diana heiraten wollte.",entertainment,2021-05-15T14:30:45Z
Schweizer-illustrierte.ch,In der Schlosskirche Fredensborg: Prinz Christian von Dänemark wurde konfirmiert - Schweizer Illustrierte,Für Prinz Christian von Dänemark ist der 15. Mai ein großer Tag: Seine Konfirmation wird gefeiert. Dabei begleitete ihn natürlich auch seine berühmte Familie.,entertainment,2021-05-15T12:53:16Z
Schweizer-illustrierte.ch,Herzogin Kate und Prinz William suchen einen neuen Gärtner - Schweizer Illustrierte,"Bei Prinz William und Herzogin Kate ist eine Stelle frei. Die beiden Royals suchen für ihr Anwesen in Norfolk einen Chefgärtner. Im Job-Angebot ist genau aufgeführt, welche Qualitäten der künftige Angestellte von Kate und William mitbringen muss. Ein ehemalig…",entertainment,2021-05-15T10:08:06Z
Www.gmx.ch,"""Phantastische Tierwesen""-Schauspieler Kevin Guthrie muss ins Gefängnis",Schauspieler Kevin Guthrie wurde zu einer Gefängnisstrafe von drei Jahren verurteilt. Der Grund: 2017 soll er eine Frau sexuell missbraucht haben.,entertainment,2021-05-15T09:48:28Z
Bluewin.ch,"Das musst du wissen, wenn du jetzt wieder fliegen willst","PCR-Test? QR-Code? Selbstdeklaration? Was du ausser dem Reisepass alles dabei haben musst, damit die Flugreise nicht ins Wasser fällt, erfährst du im Video.",entertainment,2021-05-15T07:30:00Z
Blick.ch,Katie Holmes trennt sich von ihrem Promi-Koch,Schauspielerin Katie Holmes und Promi-Koch Emilio Vitolo haben sich nach nur acht Monaten überraschend getrennt.,entertainment,2021-05-14T23:22:55Z
Bazonline.ch,Journalist verlässt BBC - Er entlockte Diana die Worte: «Waren zu dritt in dieser Ehe» - Basler Zeitung,Ein legendäres Interview macht der British Broadcasting Corporation ein Vierteljahrhundert später erneut zu schaffen. Nun zieht sich der umstrittene Interviewer Martin Bashir aus dem Job zurück.,entertainment,2021-05-14T19:54:41Z
BLICK,"Danni Büchner zieht sich für Geld auf ""BestFans"" aus",TV-Auswanderin Danni Büchner hat sich für die Online-Plattform «BestFans» im roten Badeanzug ablichten lassen. Die Bilder im «Baywatch»-Style will sie dort hinter einer Bezahlschranke veröffentlichen.,entertainment,2021-05-14T19:02:57Z
BLICK,Sommerhaus der Stars 2021: So wird die neue Staffel,Erste Details zur neuen «Sommerhaus der Stars»-Staffel sind durchgesickert. In diesem Jahr hat RTL strenge Regeln aufgestellt.,entertainment,2021-05-14T16:12:45Z
20 Minuten,"""We Are The People""",In wenigen Wochen geht die Fussball-Europameisterschaft los. Am Freitag wurde der offizielle EM-Song von Martin Garrix und den beiden U2-Legenden Bono sowie The Edge veröffentlicht.,entertainment,2021-05-14T14:30:17Z
Telebasel,"Stefanie Heinzmann: ""Ich bin der Mensch, der ich bin""","«Ich bin eine hoffnungslose Optimistin» – Stefanie Heinzmann lacht herzhaft, wenn sie das sagt. Auf ihrem neuen Album «Labyrinth» zeigt sie sich hoffnungsvoll.",entertainment,2021-05-14T13:59:08Z
20 Minuten,Georgina Fleur bestätigt Schwangerschaft,"Gerüchte um eine mögliche Schwangerschaft kursierten schon länger, jetzt ist es raus: Die Reality-TV-Darstellerin Georgina Fleur verrät, dass sie im sechsten Monat schwanger ist.",entertainment,2021-05-14T08:50:09Z
GMX.ch,GNTM (ProSieben) live im Couchticker: Klum sorgt für unangenehmen Moment - Kandidatin haut Joop um,GNTM (ProSieben): Heidi Klum hatte Wolfgang Joop an ihrer Seite - und der wurde von einer Kandidatin umgehauen. GNTM im Couchticker zum Nachlesen.,entertainment,2021-05-13T21:24:39Z
BLICK,"DJ Bobo erstickte bei ""Sing meinen Song""-Dreh fast an einem Eiswürfel","In der TV-Sendung «Sing meinen Song» kam es zu einem kritischen Vorfall – DJ Bobo verschluckte sich so heftig an einem Eiswürfel, dass Sänger Joris beherzt eingreifen musste.",entertainment,2021-05-13T20:38:34Z
