source,title,description,category,publishedAt
20 minuten,Champions League live - Di Maria tritt Fernandinho um und sieht Rot — PSG braucht ein Wunder - 20 Minuten,Wer zieht als erstes Team in das Champions-League-Final ein? PSG muss einen 1:2-Rückstand aus dem Hinspiel gegen Manchester City wettmachen. Wir tickern für euch das Halbfinal-Rückspiel live.,sport,2021-05-04T20:37:30Z
eurosport.de,Manchester City - Paris Saint-Germain live - 4 Mai 2021 - Eurosport DE,"Jetzt Champions League schauen: Manchester City - Paris Saint-Germain live auf Eurosport. Ergebnisse, Statistiken, Kommentar und Live-Ticker.",sport,2021-05-04T19:00:00Z
20 minuten,DEB schmeisst NHL-Goalie Thomas Greiss raus - 20 Minuten,Thomas Greiss sorgt immer wieder für Irritationen. Aus diesem Grund wird der NHL-Goalie nun nicht mehr für die deutsche Nationalmannschaft spielen. Seine Fans verstehen das nicht.,sport,2021-05-04T18:25:47Z
www.srf.ch,2:1-Sieg gegen Aarau - Dank Joker Tasar – Luzern steht im Cupfinal - Schweizer Radio und Fernsehen (SRF),Luzern schlägt Aarau im Cup-Halbfinal auswärts 2:1 und steht zum ersten Mal seit 2012 im Cupfinal.,sport,2021-05-04T17:27:00Z
blick.ch,Bencic trotz Liebesentzug im Höhenflug und im Madrid-Viertelfinal - BLICK,Nach einem Forfait-Sieg gegen Ons Jabeur steht Belinda Bencic im Madrid-Viertelfinal. Ihr Freund und Trainer muss dabei aus der Ferne zuschauen.,sport,2021-05-04T16:38:32Z
speedweek.com,Fabio Quartararo: Erfolgreich am Unterarm operiert - SPEEDWEEK.COM,Yamaha-Werksfahrer Fabio Quartararo entschloss sich nach dem schmerzhaften und enttäuschenden MotoGP-Rennen von Jerez (Platz 13) zu einer Armpump-OP. Für Le Mans will er zu 100 Prozent fit sein.,sport,2021-05-04T14:25:28Z
watson.ch,Transfer-Ticker: José Mourinho wird Trainer bei der AS Roma - watson,"Keinen wichtigen Wechsel und kein spannendes Gerücht mehr verpassen: Hol dir jetzt den watson-Transfer-Push! So einfach geht's:
Wenige Wochen nach seiner …",sport,2021-05-04T13:34:00Z
blick.ch,Serge Pelletier nicht mehr Lugano-Trainer - BLICK,"Schon vor dem Aus gegen die SCRJ Lakers war klar, dass die Zeit von Serge Pelletier in Lugano abgelaufen ist. Jetzt haben ihn die Tessiner verabschiedet.",sport,2021-05-04T13:19:21Z
blick.ch,Formel 1: Mercedes und Red Bull im Streit - BLICK,Vor dem vierten Saison-Rennen in Barcelona spitzt sich das Duell zwischen Mercedes und Red Bull zu. Auch neben der Strecke sägen die Bullen an der Vormachtstellung der Serienweltmeister.,sport,2021-05-04T12:50:15Z
blick.ch,Leichtgewichtsboxer Felix Verdejo tötet seine schwangere Freundin - BLICK,Felix Verdejo steht vor einer Anklage wegen Mordes. Der Box-Champion soll seine schwangere Freundin auf brutale Art und Weise umgebracht haben.,sport,2021-05-04T11:27:40Z
blick.ch,Ex-Basler mit Rundumschlag: Zdravko Kuzmanovic attackiert den FCB - BLICK.CH,"Bis vor einem Jahr war er beim FC Basel noch der Topverdiener, nun rechnet Kuzmanovic mit seinem früheren Arbeitgeber ab. Die FCB-Führung und Ciriaco Sforza bekommen ihr Fett ab – und auch gegenüber David Degen ist er skeptisch.",sport,2021-05-04T09:59:37Z
blick.ch,Verfahren gegen Aarau-Trainer Keller - BLICK,"Der Vorfall vom letzten Freitag, als Stepahn Keller auf dem Brügglifeld einen Ballbuben zusammenstaucht, hat für den Aarau-Trainer ein Nachspiel.",sport,2021-05-04T09:02:18Z
speedweek.com,Toto Wolff zum Funk an Valtteri Bottas: Klappe halten - SPEEDWEEK.COM,"​Es kommt vor, wenn auch selten: Mercedes-Teamchef Toto Wolff meldet sich am Funk bei Valtteri Bottas mit aufmunternden Worten. Später meint der Wiener: «Vielleicht sollte ich künftig die Klappe halten.»",sport,2021-05-04T08:25:58Z
mtb-news.de,XC World Cup 2021 – Albstadt: Cyclocross-Giganten vs. MTB-Spezialisten – Der Vorbericht - MTB-News.de,Das Warten hat ein Ende! In wenigen Tagen beginnt die Saison des UCI Mountain Bike World Cups in Albstadt. Hier gibt's den Favoriten-Check!,sport,2021-05-04T07:30:51Z
bluewin.ch,Eine leichte Berührung mit schweren Folgen - bluewin.ch,Das zweite Rennen des IndyCar-Grand Prix von Fort Worth war am Sonntag Schauplatz einer Massenkarambolage.,sport,2021-05-04T07:01:06Z
motorsport-total.com,Lando Norris: Chance im WM-Kampf gegen Bottas & Perez? - Motorsport-Total.com,Nach drei Rennen liegt Lando Norris in der WM vor Valtteri Bottas und Sergio Perez: Kann er am Saisonende einen von beiden hinter sich halten?,sport,2021-05-04T06:25:58Z
20 minuten,Hochspannung in Spanien und Frankreich - So irre ist der Meisterschafts-Schlussspurt in ganz Europa - 20 Minuten,"Während in der Schweiz die Young Boys schon längst als Champion feststehen, läuft in einigen Top-Ligen der Meisterkampf gerade auf Hochtouren. Wir werfen einen Blick auf die heissen Titelrennen Europas.",sport,2021-05-04T06:10:39Z
www.srf.ch,Auch Fiala und Meier treffen - In der Overtime: Josi lässt Nashville mit 2. Tor jubeln - Schweizer Radio und Fernsehen (SRF),"Roman Josi, Kevin Fiala und Timo Meier haben in den Montagsspielen der NHL zusammen 4 Treffer erzielt.",sport,2021-05-04T05:52:00Z
bluewin.ch,Allzeit-Rekord für Schweizer Curlerinnen - bluewin.ch,Die Schweizer Curlerinnen um Skip Silvana Tirinzoni gewinnen mit einem 9:4 gegen China auch ihr sechstes Spiel der WM in Calgary.,sport,2021-05-04T03:34:00Z
real total,"Real Madrids Kader gegen Chelsea: Sergio Ramos, Ferland Mendy und Fede Valverde zurück","Real Madrid reist unter anderem ohne Raphaël Varane nach London zum finalen Duell mit dem FC Chelsea. Die Personalsituation entspannt sich dennoch: Sergio Ramos, Ferland Mendy und Federico Valverde melden sich zurück und stehen im Aufgebot für das Halbfinal-Rückspiel der Champions League.",sport,2021-05-04T09:50:52Z
20 minuten,Ex-FCB-Spieler Zdravko Kuzmanovic kritisiert den FC Basel,"Beim FC Basel wird es nicht ruhiger. Nun mischt sich auch noch Ex-FCB-Star Zdravko Kuzmanovic ein. In einem Talk kritisiert er die aktuelle Führung – und Ciriaco Sforza, den ehemaligen Coach.",sport,2021-05-04T08:18:06Z
blick,Vor PSG - Manchester City: Neymar erklärt Pep Guardiola den Krieg,Das Halbfinal-Rückspiel in der Champions League zwischen Manchester City und PSG ist schon vor Anpfiff hitzig. Neymar zeigt sich kampfbereit!,sport,2021-05-04T08:01:22Z
