,source,content,category,sentiment,date_parsed
1740,bild,"Corona-Statistik: DARUM steigt die Inzidenz trotz sinkender Fallzahlen. Seit die Zahlen sinken, haben wir jeden Montag den gleichen miesen Effekt: Die 7-Tage-Inzidenz steigt trotzdem im Vergleich zu Sonntag an! So etwas kann schlechte Laune machen und macht es auch. Lesen Sie mit BILDplus, warum die Inzidenz immer montags nach ob…",science,0,2021-05-13
1741,neue zürcher zeitung,"Mutationen beim Menschen - so häufig sind sie - Neue Zürcher Zeitung. Neugeborene tragen bereits um die 75 neue Mutationen in ihrem Erbgut. Meist sind diese neutral, manchmal desaströs, aber auf lange Sicht unabkömmlich.",science,0,2021-05-13
1742,tages-anzeiger,Hier trainieren Sie Ihr Hirn - Jonglieren Sie mit Zahlen auf dem Kreis. Testen Sie Ihre mathematischen Fähigkeiten in unserer Reihe für kluge Köpfe.,science,1,2021-05-13
1743,faz - frankfurter allgemeine zeitung,"Sieben-Tage-Inzidenz sinkt unter 104. 17.419 Corona-Neuinfektionen und 278 Todesfälle, das sind wieder weniger als vor einer Woche. Entsprechend geht die Sieben-Tage-Inzidenz weiter zurück – auf 103,6. Für Urlaubsrückkehrer und Einreisende gelten ab heute gelockerte Regeln.",science,0,2021-05-13
1744,b.z. berlin,Beliebter Berliner Karate-Club vor dem Corona-K.O.. Guido Wallmann (50) hat seine Leidenschaft zum Beruf gemacht. Der ehemalige Leistungssportler eröffnete 1999 seinen eigenen Karateverein. Jetzt steht sein beliebter Sportclub Dokan vor dem Aus – weil die Coronahilfen seit Januar ausbleiben.,science,1,2021-05-12
1745,aerzteblatt.de,"COVID-19: Die meisten hospitalisierten Patienten haben neurologische... - Deutsches Ärzteblatt: Aktuelles aus Gesundheitspolitik und Medizin. Pittsburgh – Obwohl SARS-CoV-2 nach derzeitigem Kenntnisstand das Gehirn nicht infiziert, leiden 8 von 10 aller hospitalisierten COVID-19-Patienten unter... #COVID19 #Studie #JAMA",science,0,2021-05-12
1746,heise online,"Ausbildungsmarkt: Wer findet nach Corona noch einen Job?. Betriebliches Angebot nimmt um 8,8 Prozent ab. Pandemie erschwert Lage. Gewerkschaften fordern staatliche Unterstützung",science,0,2021-05-12
1747,20 minuten,"Restaurants, Homeoffice, Veranstaltungen : So stehen die Chancen für weitere Corona-Lockerungen. Am Mittwoch berät der Bundesrat erneut die Corona-Lage. Verschiedene Öffnungsschritte stehen zur Diskussion. Ein Experte schätzt ein.",science,1,2021-05-12
1748,srf,"Weltraummission ""Osiris Rex"" - Nasa-Sonde mit Asteroiden-Probe auf dem Rückweg zur Erde. Die Sonde hat als erste überhaupt eine Asteroiden-Probe entnommen. Diese soll 2023 auf der Erde ankommen.",science,1,2021-05-11
1749,heidelberg24.de,BioNTech-Nebenwirkung: Herzmuskelentzündung nach Impfung – So viele Fälle sind bekannt - heidelberg24.de. Nach Berichten von Herzmuskelentzündungen nach einer BioNTech-Impfung aus Israel ist die Verunsicherung groß. So viele Fälle der seltenen Nebenwirkung sind laut Paul-Ehrlich-Institut in Deutschland erfasst worden:,health,0,2021-05-13
1750,t-online,"Ernährung gegen Schlaganfall: Negative Effekte lassen sich ausgleichen. Eine Studie zeigt, welche Lebensmittel das Schlaganfallrisiko erhöhen und welche es reduzieren.",health,0,2021-05-13
1751,healthnewsnet.de,Multiple Sklerose: Patienten mit schwerem Verlauf fehlt Zuckermolekül - Healthnews. Ein internationales Forschungsteam fand kürzlich einen neuen Ansatz für Therapieoptionen bei der progredienten Verlaufsform von Multipler Sklerose. Die Wissen,health,1,2021-05-13
1752,n-tv nachrichten,"Arbeit an T-Zell-Impfstoff:Corona-Supervakzin soll jahrelang schützen - n-tv NACHRICHTEN. Die schnelle Impfstoff-Entwicklung gegen Corona ist ein Wunder der Medizin, das mRNA-Verfahren eine kleine Revolution. Doch alle verfügbaren Vakzine müssen wohl regelmäßig aufgefrischt werden - und wirken nicht immer gegen Mutationen. Ein anderes Verfahren wi…",health,1,2021-05-13
1753,t-online,"Frühlingszwiebeln schneiden: So viel müssen Sie entfernen. Frühlingszwiebeln können Gerichte in vielfacher Hinsicht bereichern. Viele schätzen ihren milden Geschmack. Doch wenn Sie sie verwenden möchten, sollten Sie einiges beachten.",health,1,2021-05-13
1754,bunte.de,"Studie zeigt: Mediterrane Ernährung senkt das Risiko einer Alzheimer Erkrankung - BUNTE.de. Die richtige Ernährung könnte das Risiko senken an Alzheimer zu erkranken. Das Ernährungs-Zauberwort heißt laut einer aktuellen Studie ""mediterran"".",health,1,2021-05-13
1755,badische-zeitung.de,Forscher finden Partikel von Sars-CoV-2 im menschlichen Erbgut - Gesundheit & Ernährung - Badische Zeitung. Ein Forscherteam hat ganz vereinzelt kleine Erbgutstücke des Coronavirus Sars-CoV-2 im Erbgut menschlicher Zellen gefunden. Möglicherweise ist dies eine Erklärung für falsch-positiver Tests.,health,0,2021-05-12
1756,heilpraxisnet.de,"Coronavirus: Warum Corona-Tests nach Erkrankung noch lange positiv sein können. Corona: PCR-Test noch lange nach Genesung positiv In den ersten Monaten der Corona-19-Pandemie bemerkten Mitarbeitende des Gesundheitswesens, die die Testergebnisse analysierten, etwas Seltsames: Bei Patientinnen und Patienten, die sich bereits von COVID-19 e…",health,0,2021-05-11
1757,augsburger allgemeine,"Nach langer Krankheit: Schrittweise zurück in den Job. Kehren Berufstätige nach einer längeren Krankheit zurück in den Job, ist häufig eine schrittweise Wiedereingliederung möglich und sinnvoll.",health,0,2021-05-08
1758,insuedthueringen.de,Suhl/ Zella-Mehlis - Pfefferminztee statt Verdauungsschnaps - inSüdthüringen.de. Sind ihnen die Feiertage auf den Magen geschlagen? Mitarbeiter und Ärzte des SRH-Zentralklinikums geben den Lesern von Freies Wort Tipps für ihre Gesundheit.,health,0,2020-12-21
1759,kurier,Corona: Die Suche nach universeller Impfung läuft mit Hochdruck. Französische Start-ups arbeiten an T-Zellen-Vakzin gegen Covid-19.,health,1,2021-05-13
1760,heilpraxisnet.de,"Corona-Forschung: Ist COVID-19 eine ganz andere Krankheit als bisher angenommen?. Bei COVID-19 scheint es sich um eine Gefäßerkrankung zu handeln, und nicht etwa um eine Art Atemwegserkrankung, welche durch ein Erkältungsvirus hervorgerufen wird. Die neuen Erkenntnisse helfen, die Vielzahl der scheinbar unzusammenhängenden Komplikationen von COVID-19 zu erklären und könnten eventuell die Entwicklung neuer Therapien ermöglichen.",health,0,2021-05-12
1761,mittelbayerische,"Schluckimpfung reicht wohl nicht aus. Das FAU-Team am Uniklinikum Erlangen findet heraus, dass der Darm allein nicht gegen COVID-19 ankommt.",health,0,2021-05-12
1762,heilpraxisnet.de,"COVID-19-Forschung: Abwehrkraft des Darms schafft keine Ganzkörperimmunität. Die Immunantwort des Darms kann einen gewissen Schutz gegen Infektionen mit dem Coronavirus SARS-CoV-2 bieten, da der Darm neben der Lunge einer der wichtigsten Angriffspunkte des Erregers ist. Allerdings zeigt eine aktuelle Studie von Forschenden der Friedrich-Alexander-Universität Erlangen-Nürnberg (FAU), dass der Darm allein nicht gegen COVID-19 ankommt.",health,0,2021-05-12
1763,blick,Ist Indien-Variante 50 Prozent ansteckender als britische?. Ist die indische Variante noch einmal 50 Prozent ansteckender als die britische? Dies behauptet ein Expertengremium in Grossbritannien. Auch Premierminister Boris Johnson warnt.,world,0,2021-05-14
1764,srf,Lockerungen der Massnahmen - Keine Masken für Geimpfte in den USA: Das müssen Sie wissen. Die USA planen eine Lockerung der Maskenpflicht nach vollständiger Impfung. In der Praxis stellen sich aber Fragen.,world,0,2021-05-14
1765,20 minuten,"Maha Vajiralongkorn – Rama X : Thailands König liegt wegen Atemproblemen auf Intensivstation. Der Monarch wurde kürzlich in ein Spital eingeliefert. Ob sein Gesundheitszustand durch eine Corona-Ansteckung verursacht wurde, ist derzeit noch unklar.",world,0,2021-05-14
1766,blick,Schweiz steigert das Impftempo um einen Drittel. Die Schweizer Impfkampagne macht grosse Schritte vorwärts. Das Impf-Tempo in der Schweiz ist in der letzten Woche um einen Drittel gestiegen.,world,1,2021-05-14
1767,blick,"Rettung aus brennendem Haus: Büsi springt aus fünftem Stock und rennt davon. Ein Video eines Hausbrandes in Chicago verbreitet sich wie Lauffeuer im Netz. Doch nicht etwa, weil die Flammen sonderlich spektakulär wären. Sondern weil eine Katze aus dem Fenster im fünften Stock springt!",world,0,2021-05-14
1768,20 minuten,"Gelsenkirchen (D) : Deutscher Staatsschutz ermittelt nach antisemitischem Aufmarsch. In Gelsenkirchen versammelten sich am Mittwochabend rund 180 Menschen und skandierten judenfeindliche Parolen. Mittlerweile wurde einer der Krawallmacher identifiziert, der Staatsschutz ermittelt.",world,0,2021-05-14
1769,srf,"Österreich - ""Es wird sehr unangenehm für Kanzler Kurz"". Gegen Bundeskanzler Sebastian Kurz wird ermittelt. Er sei nun in der Zwickmühle, sagt Journalist Florian Klenk.",world,0,2021-05-14
1770,blick,Nahost-Konflikt: Österreichs Kanzleramt lässt Israel-Fahne hissen. Aus Solidarität mit Israel haben Österreichs Kanzler Sebastian Kurz und Aussenminister Alexander Schallenberg auf ihren Amtsgebäuden die Fahne des Landes hissen lassen.,world,1,2021-05-14
1771,blick,Soziale Medien: Neue Datenschutz-Bestimmungen bei Whatsapp. Schon seit Anfang des Jahres gibt es Aufregung um die neuen Datenschutz-Bestimmungen bei Whatsapp. Nach erster Kritik und eine Abwanderung von Nutzern verschob Facebooks Chat-App die Einführung von Februar auf Mai. Die Änderungen werden jetzt sanfter umgesetzt.,world,0,2021-05-14
1772,20 minuten,"Francina Armengol : Präsidentin der Balearen erlaubt diesen Sommer noch keine Partys. Das Nachtleben auf den Balearen bleibt diese Saison noch aus, wie Präsidentin Francina Armengol sagt. Sommer-Touristen müssen sich wohl auf Urlaub ohne Clubbesuche einstellen.",world,0,2021-05-14
1773,blick,Stromausfall in der Region Aarau. In mehreren Gemeinden im Kanton Aargau kam es am Freitagabend zu einem Stromausfall. Dieser dauerte rund zwei Stunden.,world,0,2021-05-14
1774,blick,"Covid: In diesen Ländern Europas herrscht keine Quarantänepflicht. Die Temperatur steigt und die Reiselust ebenso. Blick zeigt die 13 Länder in Europa auf, wo Schweizer aktuell ohne Quarantäne-Auflagen einreisen dürfen.",world,1,2021-05-14
1775,20 minuten,Ferien ohne Quarantäne : Italien hebt die Quarantänepflicht für Touristen auf. Ab Sonntag dürfen Touristen aus der EU und einigen anderen Ländern ohne Quarantäne nach Italien reisen. Ein negativer Test reicht ab dann aus.,world,0,2021-05-14
1776,blick,Gericht erklärt Tengelmann-Chef Karl-Erivan Haub für tot. Gut drei Jahre nach seinem Verschwinden in den Schweizer Alpen hat das Kölner Amtsgericht den Milliardär Karl-Erivan Haub für tot erklärt.,world,0,2021-05-14
1777,20 minuten,Linie 10 : Unbekannte verprügeln Mann (20) in Zürcher Tram. Im Zürcher Tram 10 wurde ein 20-jähriger Mann von einer Gruppe Unbekannter angegriffen und verletzt. Er musste ins Spital gebracht werden. Die Polizei bittet um Mithilfe.,world,0,2021-05-14
1778,20 minuten,Absturz im Reichen-Ranking : Elon Musk verliert nach SNL-Auftritt 20 Milliarden Dollar an Wert. Die Witze des Tesla-Chefs über Kryptowährungen sorgten für einen Kurssturz. Nun schrumpfte auch sein Vermögen. Musk ist nicht mehr der zweitreichste Mensch der Welt.,world,0,2021-05-14
1779,blick,St. Galler Schulen warnen vor strengen Corona-Regeln in Graubünden. Die Corona-Massnahmen werden schweizweit langsam gelockert. Die St. Galler Schüler freuen sich deshalb auf die Klassenlager im Sommer. Die strengen Vorschriften im Kanton Graubünden dürften jedoch manche Kinderträume platzen lassen.,world,0,2021-05-14
1780,blick,"Schweiz: Neue Art der Virushemmung gefunden. ETH-Forschende haben eine wichtige Schwachstelle des Coronavirus' entdeckt: Stört man einen bestimmten Prozess, hemmt das die Vermehrung des Erregers. Aus dieser Erkenntnis lässt sich möglicherweise ein Medikament entwickeln, das alle Varianten des Virus' angreift.",world,0,2021-05-14
1781,gamers.at,"Die Sims 4 erhält Innenhof-Oase-Set. Die Sims 4 und Electronic Arts kündigen das Innenhof-Oase-Set an, das ab dem 18. Mai 2021 erhältlich sein wird.",world,1,2021-05-14
1782,gmx.ch,GNTM im Couchticker: Klum sorgt für unangenehmen Moment - Kandidatin bringt Joop zum Weinen. Heidi Klum hatte Wolfgang Joop an ihrer Seite - und der wurde von einer Kandidatin umgehauen. GNTM im Couchticker zum Nachlesen.,world,0,2021-05-14
1783,bluewin.ch,"GC nach Remis bei Xamax noch einen Sieg vom Aufstieg entfernt. Die Grasshoppers haben es vor der letzten Runde der Challenge League in der Hand, nach zwei Jahren in die Super League zurückzukehren. GC spielt in Neuenburg 1:1, Thun verliert daheim gegen Aarau 1:3.",world,0,2021-05-14
1784,srf,News aus der National League – ZSC Lions holen KHL-Stürmer und verabschieden Wick. Hier finden Sie die wichtigsten Kurzmeldungen des Tages aus dem Schweizer Eishockey-Geschehen.,world,1,2021-05-14
1785,srf,"Das Neueste zur Coronakrise - Johnson: Indische Virus-Variante gefährdet Lockerungspläne. Die für Ende Juni geplante Aufhebung aller Massnahmen könnte erschwert werden, so Premierminister Boris Johnson.",world,0,2021-05-14
1786,aargauer zeitung,Stromversorgung - 80 Minuten kein Pfuus in der Kantonshauptstadt ++ Eniwa-CEO meldet: Alle Kunden haben wieder Strom. In der Region Aarau war es zu einem grossflächigen Stromausfall gekommen.,world,0,2021-05-14
1787,nau.ch,"«Grossstörung» bei Swisscom und Sunrise wieder behoben. Kunden der beiden grössten Netzanbieter, Sunrise und Swisscom, meldeten Probleme. Die Störungen seien laut den Anbietern wieder behoben.",world,0,2021-05-14
1788,watson,NHL: watson tippt die Stanley-Cup-Playoffs 2021 – Teil 1. Bereits in der Nacht auf Sonntag beginnen in der NHL die Stanley-Cup-Playoffs. Im ersten Teil der Vorschau analysieren wir die Serien in der North und der East Division.,world,1,2021-05-14
1789,watson,"James Mays Tesla ist kaputt und er ist mega genervt. Wer hätte das gedacht: Bei langen Standzeiten kann es dazu kommen, dass sich der Tesla Model S keinen Meter bewegen lässt, obwohl der Akku randvoll ist.",world,0,2021-05-14
1790,deavita.com,"Nichts riechen können - Geruchsverlust wegen Coronavirus - DEAVITA. Forscher berichten über die entdeckten Mechanismen der kurz- und langfristigen Anosmie bei Sars-CoV-2, wenn Menschen nichts riechen können.",world,0,2021-05-14
1791,srf,Grenze zu Basel - Deutschland erlaubt Einkaufstourismus: Das lief in Weil am Rhein. Seit Donnerstag dürfen Schweizer wieder in Deutschland einkaufen. In den Läden hatte es am Freitag noch genügend Platz.,world,0,2021-05-14
1792,blick,"Robert Geiss teilt nach Pizzeria-Verweis in Köln aus. Robert Geiss ist hässig, nachdem ihn das deutsche Ordungsamt aus einer Pizzeria geworfen hat. Er findet, dadurch sei sein Dreh verunmöglicht worden – und will nun Schadensersatz.",world,0,2021-05-14
1793,nau.ch,Kritische Sicherheitslücken bedrohen WordPress Versionen 3.7 bis 5.7. WordPress gehört weltweit zu den beliebtesten und meistgenutzten CMS-Tools. Nun wurden in WordPress kritische Sicherheitslücken gefunden und gepatcht.,world,0,2021-05-14
1794,it magazine,"Künftige iPhones mit kleinerem Face-ID-Chip. Um den Platzbedarf zu verringern und günstigere Produktionskosten zu erzielen, soll Apple in kommenden iPhone- und iPad-Modellen einen signifikant kleineren VCSEL-Chip für die Gesichtserkennung Face ID einsetzen.",world,1,2021-05-14
1795,infranken.de,"Erlanger Forscher zu Covid-19: Abwehrkraft des Darms reicht nicht aus - Folgen für Impfungen? - inFranken.de. Forscher aus Erlangen sehen Hinweise, dass eine orale Impfung gegen das Coronavirus möglicherweise keinen Nutzen hat. Die Abwehrkraft des Darms alleine sei nicht ausreichend, um eine Corona-Infektion abwehren zu können.",world,0,2021-05-14
1796,neue zürcher zeitung,"Was steckt wirklich hinter Elon Musks Bitcoin-Kehrtwende? - Neue Zürcher Zeitung. Der hohe Energieverbrauch der Kryptowährung war längst bekannt, als Tesla beschloss, Bitcoin als Zahlungsmittel zu akzeptieren.",world,0,2021-05-14
1797,blick,Meineimpfungen.ch stellt Betrieb ein. Die Plattform «meineimpfungen.ch» wird eingestellt. Die gravierenden Sicherheitsmängel konnten nicht behoben werden.,world,0,2021-05-14
1798,telebasel,Das Rüebli ist das Lieblingsgemüse der Schweiz. Das Rüebli oder die Karotte ist und bleibt das Lieblingsgemüse der Schweizerinnen und Schweizer. Fast neun Kilo davon vertilgten sie 2020 pro Kopf.,world,1,2021-05-14
1799,20 minuten,Erster Titel nach vier Jahren - So feierten die Schweizer BVB-Stars den Pokalsieg gegen RB Leipzig. Mit einer Machtdemonstration gewann der BVB am Donnerstagabend das Pokalfinal gegen RB Leipzig mit 4:1. Mittendrin die Schweizer Roman Bürki und Manuel Akanji.,world,1,2021-05-14
1800,tages-anzeiger,Neue Art der Virushemmung - ETH-Forschende entdecken Schwachstelle des Coronavirus'. Die Fachleute haben eine Schwachstelle des Virus entdeckt. Aus dieser Erkenntnis könnte ein neues Medikament entwickelt werden.,world,0,2021-05-14
1801,limmattalerzeitung.ch,"Winterthur - «Mission Rudolf»: Wer die Bombe entschärfen will, muss tanzen - Limmattaler Zeitung. Wer sich mit dem Handy auf die «Mission Rudolf» begibt, lernt die Stadt Winterthur neu kennen. Und erfährt Wissenswertes über die Kunstform Tanz. Es wird gerätselt, bis die Stadt gerettet ist.",world,1,2021-05-14
1802,blick,Thurgau knallhart: Grenzgänger nicht zur Impfung zugelassen. Der Kanton Thurgau räumt der eigenen Bevölkerung Priorität beim Impfen ein. Das Nachsehen haben die Grenzgänger. Sie müssen sich gedulden.,nation,0,2021-05-14
1803,srf,"Labortheorie vs. Fledermauskot - Ursprung von Sars-CoV-2 immer noch unklar. 20 Forschende wollen endgültig Klarheit darüber, ob das Coronavirus direkt aus der Tierwelt oder aus einem Labor stammt.",nation,0,2021-05-14
1804,telebasel,"Reaktionen auf das Parkhaus-Aus. Für die Befürworter des Landhofparkings ist es ein Sieg der Verhinderungspolitik. Die Gegner können noch kaum glauben, dass das Projekt am Ende sein soll.",nation,0,2021-05-14
1805,20 minuten,"Rentnerin aus Engelburg SG wird gebüsst, weil sie einen fremden Kater fütterte. Eine Rentnerin aus Engelburg fütterte regelmässig einen zugelaufenen Kater. Dieser hat aber bereits eine Besitzerin. Sie hat nun Anzeige erstattet.",nation,0,2021-05-14
1806,20 minuten,"Israelitische Gemeinde warnt Mitglieder. Am Samstag soll in Basel eine nicht bewilligte Kundgebung von Palästina-Aktivisten stattfinden. Politiker fürchten, dass dort judenfeindliche Parolen skandiert werden und die Israelitische Gemeinde rät ihren Mitgliedern, die Demos zu meiden.",nation,0,2021-05-14
1807,20 minuten,"Coronavirus - Kinder ab 10 sollen sich auch gegen den Willen der Eltern impfen lassen können. Zehnjährige Kinder sollen selbst entscheiden können, ob sie sich impfen lassen wollen, so das BAG. Jus-Professorin Regina Aebi-Müller unterstützt die Empfehlung.",nation,0,2021-05-14
1808,blick,"Zürich: Andreas Widmer übergibt Täter am Hauptbahnhof der Polizei. Andreas Widmer (59) beobachtet, wie ein Mann am Zürcher Hauptbahnhof eine Frau vor einen einfahrenden Zug stösst. Der Augenzeuge reagiert sofort – mit Erfolg.",nation,1,2021-05-14
1809,neue zürcher zeitung,"Vermisster Tengelmann-Chef Haub von Gericht für tot erklärt - Neue Zürcher Zeitung. NZZ Nachrichten, Hintergründe, Meinungen aus der Schweiz, International, Sport, Digital, Wirtschaft, Auto & mehr. Fundierte Berichterstattung rund um die Uhr.",business,1,2021-05-14
1810,srf,"Kurz vor Finma-Zulassung – Facebooks Kryptowährung verlässt die Schweiz. Die Kryptowährung Diem verlässt Genf und zieht in die USA, obwohl das Zulassungsgesuch bei der Finma fast durch wäre.",business,0,2021-05-14
1811,watson,"Nächstes Jahr fährt in Deutschland der erste Wasserstoff-Zug. Adieu, Diesel! Ab März 2022 wird in Deutschland der erste Wasserstoff-Zug nach Fahrplan fahren. In der Schweiz scheint die Technologie für die Zugfahrt aber keine Zukunft zu haben.",business,0,2021-05-14
1812,20 minuten,Tesla : Ein Tweet von Elon Musk und Bitcoin bricht um 15 Prozent ein. Bitcoin soll bei Tesla nicht mehr als Zahlungsmittel gelten. Das kündigte Elon Musk in einem Tweet an. Der Kurs der Kryptowährung brach daraufhin ein.,business,0,2021-05-13
1813,blick,"Konjunktur USA: US-Inflation überraschend stark an. Die Inflation in den USA hat im April überraschend stark zugelegt. Gegenüber dem Vorjahresmonat stiegen die Lebenshaltungskosten um 4,2 Prozent, wie das Arbeitsministerium am Mittwoch in Washington mitteilte.",business,1,2021-05-12
1814, cash,Cyber-Devisen - Ethereum: Mehr als nur eine Kryptowährung. Innerhalb weniger Wochen hat Ethereum die Marken von 3000 und 4000 Dollar geknackt.,technology,1,2021-05-14
1815,20 minuten,"Fake-News : Nein, das Internet wird im Juli nicht abgestellt. Laut einem Tweet kommt es in zwei Monaten zu einem kompletten Netz-Blackout. Dahinter steckt eine bekannte Verschwörungstheoretikerin.",technology,0,2021-05-14
1816,techbook,"27 kostenpflichtige Apps, die es für kurze Zeit gratis gibt. Sowohl bei Android als auch iOS gibt es immer wieder kostenpflichtige Apps, die für einen bestimmten Zeitraum gratis angeboten werden.",technology,0,2021-05-14
1817,finews.ch,Marco Bizzozero stellt seine Mannschaft zusammen. Die US-Finanztechnologie-Firma iCapital Network will unter der Ägide von Marco Bizzorzero aus der Schweiz heraus in Europa sowie in Asien expandieren. Dafür stossen zwei langjährige Banker zum Unternehmen.,technology,1,2021-05-14
1818,srf,"Technologie - QR-Codes: Brücken zwischen realen und virtuellen Welten. Es gibt Erfindungen, die viel jünger wirken, als sie sind. QR-Codes gibt es seit 1994, etabliert sind sie erst jetzt.",technology,1,2021-05-14
1819, cash,"Google-Suchanfragen - Ether, Bitcoin, Dogecoin: Die Schweiz ist Krypto-verrückt wie noch nie. Eine Exklusiv-Auswertung von Google Schweiz für cash.ch zeigt das massiv gestiegene Interesse an Kryptowährungen. Neueinsteiger denken beim Thema Geldanlage primär an Bitcoin und Ether, weniger an Aktien und Immobilien.",technology,1,2021-05-14
1820,chip online,"Auto-Tacho mit GPS: Kostenlos für kurze Zeit. Einen Fahrrad-Computer zu montieren ist ziemlich umständlich und am Ende sind die Ergebnisse meist auch nicht absolut präzise. Einfacher geht es mit einem GPS-Tacho am Handy. Für Android gibt es nur noch heute eine solche App kostenlos – wir zeigen Ihnen, warum Sie sich die Anwendung unbedingt sichern sollten.",technology,1,2021-05-14
1821,20 minuten,"Neue Kettenreaktionen? : Forscher sorgen sich wegen Tschernobyl – Kraftwerk-Verwaltung dementiert. Messungen deuten darauf hin, dass es im geschmolzenen Kernbrennstoff von Tschernobyl erneut nukleare Kettenreaktionen gibt. Das sagen Forscher. Die Verwaltung des ehemaligen Kraftwerks sieht dafür keine Anhaltspunkte.",technology,0,2021-05-14
1822,20 minuten,"Ransomware : Hacker attackieren Gesundheitssystem von Irland – Computer heruntergefahren. Ein Angriff auf das IT-System der irischen Gesundheitsbehörde hat die Regierung dazu veranlasst, dieses vorübergehend herunterzufahren.",technology,0,2021-05-14
1823,elektroauto-news.net,"Tesla auf dem Weg zum größten Unternehmen der Welt. Für Tesla scheint es nur nach vorne/ aufwärts zu gehen. Sowohl beim E-Auto-Absatz, an der Börse, als auch bei neuen Geschäftsfeldern, wie wir aufzeigen.",technology,1,2021-05-14
1824,telebasel,"Stefanie Heinzmann: «Ich bin der Mensch, der ich bin». «Ich bin eine hoffnungslose Optimistin» – Stefanie Heinzmann lacht herzhaft, wenn sie das sagt. Auf ihrem neuen Album «Labyrinth» zeigt sie sich hoffnungsvoll.",entertainment,1,2021-05-14
1825,20 minuten,"Reality-TV-Baby - Georgina Fleur bestätigt Schwangerschaft. Gerüchte um eine mögliche Schwangerschaft kursierten schon länger, jetzt ist es raus: Die Reality-TV-Darstellerin Georgina Fleur verrät, dass sie im sechsten Monat schwanger ist.",entertainment,1,2021-05-14
1826,nau.ch,Jetzt spricht Stefan Mross nach Doppelmord in Familie. Schlagerstar Stefan Mross meldet sich erstmals nach dem Doppelmord in seiner Familie. Ein Stalker hatte seine Cousine und Tante umgebracht.,entertainment,0,2021-05-14
1827,bluewin.ch,"Kritik an Prinz Charles fliegt Harry um die Ohren. Prinz Harry mag inzwischen mit seiner Familie in den USA leben, für Wirbel im britischen Königshaus sorgt er gleichwohl noch: Nach offener Kritik an seinem Vater wird er im Boulevard gescholten.",entertainment,0,2021-05-14
1828,gmx.ch,"GNTM im Couchticker zum Nachlesen: Kandidatin haut Wolfgang Joop um - Heidi Klum sorgt für unangenehmen Moment. In Folge 15 von GNTM wurde es heiss. An ihrer Seite hatte Heidi Klum nicht nur Wolfgang Joop, sondern auch noch die Tänzer von Magic Mike. Eine Kandidatin haute den Star-Designer um. Wer schaffte es ins Halbfinale und welche Kandidatin scheiterte kurz vor kna…",entertainment,0,2021-05-14
1829,nau.ch,Angelina Jolie führt bei Männersuche eine Tabu-Liste. Seit der Trennung von Brad Pitt ist Angelina Jolie single. Das dürfte wohl an ihrer langen Liste der No-Gos liegen.,entertainment,0,2021-05-13
1830,schweizer-illustrierte.ch,"So hin und weg war Prinz William zu Uni-Zeiten von Herzogin Kate - Schweizer Illustrierte. Schon zu Uni-Zeiten war Prinz William Feuer und Flamme für Herzogin Kate. Wie sich das äußerte, berichtete nun eine ehemalige Kommilitonin.",entertainment,0,2021-05-13
1831,blick,Ellen DeGeneres hört mit eigener Show auf. Die «Ellen DeGeneres Show» hat Kultstatus. Doch die berühmte Talkerin zieht jetzt den Stecker. Die Gründe dafür sollen aber nicht bei den Kritiken vom letzten Jahr liegen.,entertainment,1,2021-05-13
