,source,content,category,sentiment,date_parsed
2574,20 minuten,"Bewaffneter Berufssoldat versetzt Belgien in Angst – Moscheen bleiben zu. Moscheen bleiben zu, Kinder zuhause: In Belgien läuft die fieberhafte Suche nach dem Rechtsextremen Jurgen Conings weiter. Im Auto des Berufssoldaten hat die Polizei derweil vier Panzerabwehrraketen gefunden.",world,0,2021-05-20
2575,srf,Coronavirus - EU einigt sich auf Covid-Zertifikat. Mit der Einführung eines digitalen Zertifikats sollen Reisen innerhalb der EU erleichtert werden.,world,1,2021-05-20
2576,20 minuten,"Neue Spur für die Ermittler. Vor 14 Jahren verschwand die vierjährige Maddie McCann in Portugal spurlos. Im vergangenen Jahr geriet der Deutsche Christian B. in den Fokus der Ermittler. Nun wurde bekannt, dass B. mit einem internationalen Pädophilenring in Paraguay im Austausch stand.",world,0,2021-05-20
2577,blick,Skandal im Österreich: Ärzte amputieren Patienten das falsche Bein. Skandal in einem Spital in Österreich: Einem Patienten wurde das falsche Bein amputiert.,world,0,2021-05-20
2578,blick,"Corona-Inzidenz: Schweden mit höchster Neuinfektionszahl in der EU. Nirgendwo in der EU stecken sich derzeit mehr Menschen neu mit dem Coronavirus an, als in Schweden. Immerhin bei den Covid-Todesfällen steht das Land besser da.",world,1,2021-05-20
2579,blick,"""Ich fühle mich besser"": Rumäne lässt sich drei Mal gegen Corona impfen. Gleich drei Mal holt sich ein Rumäne (49) die begehrte Corona-Impfung ab. Nun droht ihm ein Strafverfahren.",world,0,2021-05-20
2580,blick,Jürgen Conings - Belgischer Ex-Soldat droht mit Anschlag auf Virologen. In Belgien sucht ein riesiges Aufgebot von Polizei- und Militär-Einheiten nach dem Ex-Soldaten Jürgen Conings. Dieser soll schwer bewaffnet sein und droht mit mehreren Anschlägen – unter anderem auch auf einen bekannten Virologen des Landes.,world,0,2021-05-20
2581,srf,Antarktis - Am Südpol löst sich die momentan weltweit grösste Eisscholle. Er könnte Mallorca glatt unter sich begraben: In der Antarktis bricht ein neuer Eisberg derzeit alle Rekorde.,world,0,2021-05-20
2582,blick,"Tiktok-Chef tritt zurück und gibt zu: Chef zu sein, ist nicht so mein Ding. Er ist der kreative Kopf hinter der beliebtesten App der Jugend. Der Mitbegründer der Unterhaltungs-App Tiktok räumt jetzt seinen Posten. Die Begründung für seinen Rückzugs ist bemerkenswert ehrlich.",world,0,2021-05-20
2583,srf,Thun muss in die Barrage - Dank 2:1-Sieg gegen Kriens: GC ist zurück in der Super League. Die Grasshoppers kehren dank einem 2:1-Sieg gegen Kriens in die Super League zurück. Thun muss in die Barrage.,world,1,2021-05-20
2584,20 minuten,GC macht von Beginn weg wieder Druck – die Fans feiern weiter. Die Grasshoppers und der FC Thun machen im Fernduell den Aufsteiger in die Super League unter sich aus. Die Aufstiegs-Konferenz live im Ticker.,world,1,2021-05-20
2585,20 minuten,"Bessere Zukunft in Europa. Tausende marokkanische Minderjährige versuchten, schwimmend das spanische Territorium an der nordafrikanischen Küste zu erreichen. Einige berichten von ihren traumatischen Erfahrungen.",world,1,2021-05-20
2586,20 minuten,"Homophober «Frauentausch» : RTL2 nimmt nach Skandalfolge alle Folgen von «Frauentausch» vom Netz. Die homophoben Äusserungen einer Tauschmutter schockierten die Zuschauer. Ausgestrahlt wurde die Sendung ausgerechnet am internationalen Tag gegen Homo-, Bi-, Inter- und Transphobie.",world,0,2021-05-20
2587,srf,"12. Etappe beim Giro - De Marchi verunfallt schwer, Mäder steigt aus, Vendrame siegt. Alessandro De Marchi ist auf der 12. Etappe des Giro d'Italia schwer gestürzt. Gino Mäder beendete die Rundfahrt.",world,0,2021-05-20
2588,srf,3-Satz-Niederlage in Genf - Spielverderber Andujar: Stricker scheitert im Viertelfinal. Dominic Stricker verliert gegen Pablo Andujar in 3 Sätzen und scheidet im Viertelfinal aus.,world,0,2021-05-20
2589,20 minuten,"Geheimes Bundesratspapier : Scheitern beim Rahmenabkommen hätte «schwerwiegende Folgen». Der Bundesrat scheint nicht mehr an das Rahmenabkommen zu glauben. Dabei müsste die Schweiz mit teils erheblichen Folgen rechnen, heisst es in einem hauseigenen Papier.",world,0,2021-05-20
2590,srf,Gestorben mit 80 Jahren - Fitness-Pionier Werner Kieser ist tot. Der Unternehmer und Fitness-Coach Werner Kieser ist gestorben. Er wurde 80 Jahre alt.,world,1,2021-05-20
2591,blick,"Spengler Cup 2021: Diese sechs Teams kämpfen um Titel. Neben Gastgeber Davos, National-League-Konkurrent Ambri und dem Team Canada werden in der Altjahreswoche je eine finnische, eine schwedische und eine tschechische Mannschaft im Einsatz sein.",world,1,2021-05-20
2592,srf,Externe Untersuchung - Nach Ju-52-Absturz: Schweizer Luftfahrt erfüllt Aufsichtspflicht. Eine externe Untersuchung entlastet das Bundesamt für Zivilluftfahrt. Bei der Aufsicht kann das Bazl aber nachbessern.,world,0,2021-05-20
2593,nau.ch,Sharp Aquos R6: Leica hilft bei Kamera-Entwicklung mit. Bald erscheint mit dem Sharp Aquos R6 ein neuer Player in Sachen Smartphones mit ausgezeichneter Kamera. Leider zunächst nur in Japan.,world,0,2021-05-20
2594,bluewin.ch,"Strickers Märchen ist vorbei – Niederlage gegen Andujar in drei Sätzen. Für Dominic Stricker endet der Höhenflug in Genf im Viertelfinal. Der junge Schweizer unterlag dem Spanier Pablo Andujar, der schon Roger Federer eliminiert hatte, nach 6:4, 3:1-Führung mit 6:4, 4:6, 4:6.",world,0,2021-05-20
2595,merkur.de,Neuartiges Coronavirus bei Hunden entdeckt: Mutation könnte Übertragung auf Mensch ermöglichen - Merkur.de. Coronaviren gibt nicht erst seit dem Jahr 2019. Bereits vor beinahe 20 Jahren infizierten sich Menschen mit solchen Viren. Jetzt entdeckten Forscher ein neuartiges Coronavirus.,world,1,2021-05-20
2596,nau.ch,Outriders soll Fortsetzung erhalten. Keine zwei Monate nach Launch des ersten Teils erklärt Entwickler Square Enix «Outriders» zum Franchise. Eine Fortsetzung wird es also auf jeden Fall geben.,world,1,2021-05-20
2597,20 minuten,Graubünden - Bergbahnen schätzen 1 Milliarde weniger Schaden dank offener Skigebiete. Der Kanton Graubünden liess im Gegensatz zu anderen Kantonen im letzten Winter die Skigebiete offen. Nun gibt es eine erste Bilanz – mit positiven und negativen Seiten.,world,0,2021-05-20
2598,telebasel,Weiterer Corona-Fall am Eurovision Song Contest. Der Niederländer Duncan Laurence hat sich mit dem Coronavirus infiziert und kann daher nicht live beim Finale des Eurovision Song Contest auftreten.,world,0,2021-05-20
2599,tages-anzeiger,"Politiker und Plagiatsaffären - Doktorarbeiten unter Verdacht. Die zurückgetretene Familienministerin Franziska Giffey ist nicht die erste deutsche Amtsträgerin, die wegen ihrer Dissertation in der Kritik steht. Ein Überblick mit prominenten Namen.",world,0,2021-05-20
2600,faz - frankfurter allgemeine zeitung,EU bestraft UBS und weitere Banken. Die Beteiligung an einem Anleihen-Handels-Kartell kommt drei Großbanken teuer zu stehen. Die EU-Kartellbehörden verhängten am Donnerstag gegen drei Banken eine Geldstrafe.,world,0,2021-05-20
2601,netzwoche.ch,"Meet-Anrufe sind bald direkt aus Google Docs heraus möglich - Netzwoche. Google hat an der Google I/O Neuerungen an seinem ""Workspace"" präsentiert. Unter dem Namen ""Smart Canvas"" sollen Kollaborationen einfacher und effizienter werden. Dazu sind unter anderem bald Meet-Sitzungen direkt aus Docs, Sheets und Slides möglich.",world,1,2021-05-20
2602,telebasel,Basel Vier Jahre bis zur Erholung des Tourismus. Der Tourismus hat in Basel stark unter der Corona-Pandemie gelitten. Im Jahr 2020 brachen die Übernachtungen um 62 Prozent ein.,world,1,2021-05-20
2603,it magazine,Windows-10-Mai-Update steht bereit. Microsoft hat die Verfügbarkeit der Version 21H1 von Windows 10 bekanntgegeben. Die Auslieferung erfolgt allerdings gestaffelt über die kommenden Wochen hinweg.,world,1,2021-05-20
2604,blick,"Geldsegen für Prämienzahler: Assura will Reserven radikal reduzieren. Dieser Vorschlag hat Sprengstoff. Die Krankenversicherung Assura schlägt vor, die Reserven deutlich zu reduzieren. Das könnte zu einem Geldsegen für die Prämienzahler führen. Neben Assura planen weitere Kassen Geldgeschenke zum Reservenabbau.",nation,0,2021-05-20
2605,blick,"Zürich: Polizistenschule auch ohne Schweizer Pass. Wer Polizist werden will, braucht den roten Pass – so die Regel in den meisten Kantonen. In Zürich wird diese Praxis aufgeweicht. Dort sollen jetzt auch Ausländer die Polizeischule besuchen dürfen.",nation,0,2021-05-20
2606,20 minuten,Beschwerde eingereicht : Piratenpartei wirft Bundesrat Lügen im PMT-Abstimmungsbüchli vor. In den Augen der Piratenpartei führen die Behörden im Vorfeld der Abstimmung zum PMT-Gesetz die Wählerschaft bewusst in die Irre. Nun hat die Partei offiziell Beschwerde erhoben.,nation,0,2021-05-20
2607,blick,"Nummernschild ""BL 1"" wieder aufgetaucht: beim Putzen in einer WG gefunden. Vor fünf Jahren verschwand die prominente Autonummer «BL 1» über Nacht aus der Garage Keigel im Kanton Basel-Landschaft. Nun ist das Schild völlig unverhofft wieder per Post zurück bekommen – Absender unbekannt. Garagist Urs Keigel ist überglücklich.",nation,1,2021-05-20
2608,srf,Das Neueste zur Coronakrise - Corona-Schutzmassnahmen: Suva stellt Firmen gutes Zeugnis aus. Die Unfallversicherung hat seit Ende März 2020 über 19'000 Betriebe unter die Lupe genommen.,nation,1,2021-05-20
2609,blick,"Piratenpartei reicht Abstimmungsbeschwerde gegen Anti-Terror-Gesetz ein. Mit Fehlinformationen und schwammigen Formulierungen wolle der Bundesrat das Stimmvolk in die Irre führen, kritisiert die Piratenpartei. Sie erhebt nun eine Abstimmungsbeschwerde zum Anti-Terror-Gesetz.",nation,0,2021-05-20
2610,20 minuten,"5 Verletzte in Aarau. Bei einem Unfall in Aarau sind am Mittwoch mehrere Personen verletzt worden. Der Mercedes sei mit übersetztem Tempo unterwegs gewesen, berichten Augenzeugen.",nation,0,2021-05-20
2611,blick,Teenager (19) donnert mit Mercedes in Schmuckgeschäft. Luxusschlitten gegen Luxusgeschäft. In der Aarauer Innenstadt knallte ein Mercedes gegen die Fassade eines Schmuckgeschäfts. Fünf Personen wurden leicht verletzt.,nation,0,2021-05-20
2612,20 minuten,"2,10 Meter lang : Riesenwels ist 22 Kilo schwerer als sein Fischer. Ein Fischer hat einen Riesenwels aus dem Bodensee gezogen. Das Tier misst 2,10 Meter und wiegt 87 Kilo. Damit ist dieser Fisch grösser und schwerer als Berno Spicker, der ihn gefangen hat.",nation,1,2021-05-20
2613,neue zürcher zeitung,Wirecard: Der Whistleblower Pav Gill tritt ins Rampenlicht - Neue Zürcher Zeitung. Beim Auffliegen des Wirecard-Skandals hat ein Whistleblower in Singapur eine zentrale Rolle gespielt. Nun hat er seine Anonymität aufgegeben und tritt erstmals öffentlich auf.,business,1,2021-05-20
2614,watson,Bitcoin stabilisiert sich nach Absturz auf tieferem Niveau. Der Bitcoin und die weiteren Kryptowährungen haben sich am Donnerstag nach dem drastischen Preissturz vom Vortag wieder stabilisiert. Experten erwarten …,business,1,2021-05-20
2615,20 minuten,"Netzstörung - Swisscom-Kunden kämpfen mit stockendem Internet. Mehrere Kunden hatten am Donnerstagmorgen von unterbrochenen Internetleitungen berichtet. Kurz vor 11 Uhr meldet das Unternehmen, dass die Störung behoben ist.",business,0,2021-05-20
2616,ecomento.de,„ID.X“: VW-Chef zeigt sportlichen ID.3-Prototyp mit 245 kW (333 PS) - ecomento.de. VW hat eine Sportversion des Kompakt-Elektroautos ID.3 vorgestellt: den ID.X. Eine Serienfertigung ist vorerst aber nicht geplant.,business,1,2021-05-20
2617,insideparadeplatz.ch,CS wird zum indischen IT-Konzern - Inside Paradeplatz. Finanzgruppe bald mit 10'000 Informatikern auf dem Subkontinent präsent. Schon heute arbeiten mehr als 13 Prozent der CS-Leute in Indien.,business,1,2021-05-20
2618,telebasel,Dufry auch im ersten Quartal 2021 stark von der Pandemie betroffen. Der Reisedetailhändler Dufry hat im ersten Quartal 2021 weiter stark unter der Coronakrise gelitten.,business,0,2021-05-20
2619,tages-anzeiger,«Die Nerven liegen blank» - Kryptomarkt-Crash setzt Wall Street zu. Belastet von Kursverlusten bei Kryptowerten hat die Wall Street den dritten Tag in Folge nachgegeben. Inflationssorgen liessen die Anleger nicht los.,business,0,2021-05-19
2620,watson,E-Manta: Opel überrascht alle mit dem coolsten Elektroau des Jahres. Die wichtigsten News aus der spannenden Welt der Elektromobilität.,business,1,2021-05-19
2621,aerotelegraph,Jetblue steuert London Heathrow und Gatwick an. Die amerikanische Fluglinie wird New York gleich mit zwei Londoner Flughäfen verbinden. Auch Startzeitpunkt und Preise von Jetblues Transatlantikflügen sind nun bekannt.,business,1,2021-05-19
2622,watson,"Kryptowährungen im freien Fall: Der Bogen wurde überspannt.. Ein schwarzer Tag für die Kryptowährungen. Bitcoin, Ether und Co. stürzen radikal ab",business,0,2021-05-19
2623,20 minuten,Nachhaltiger Treibstoff - Air France fliegt mit Speiseöl im Tank nach Kanada. Sogenannter Sustainable Aviation Fuel (SAF) wird derzeit hauptsächlich aus Biomasse wie nicht mehr genutzten Pflanzen- und Speiseölen hergestellt. Die Air France hats ausprobiert.,business,1,2021-05-19
2624,blick,Swisscom erhöht das Surftempo der Internetabos. Wegen der Homeoffice-Pflicht erhöht die Swisscom die Surfgeschwindigkeit auf den kleinen und mittleren Internetabos. Die Kunden mit dem Internet-S-Abo sind mit 100 Megabit pro Sekunde (Mbit/s) ab sofort doppelt so schnell unterwegs wie bisher.,business,1,2021-05-19
2625,handelsblatt,"Bitcoin, Ether und Dogecoin: Bitcoin erholt sich nach Einbruch – Kurs wieder über 35.000 Dollar - Handelsblatt. Nach dem Tief von 30.682 Dollar legt der Bitcoin-Kurs wieder zu. Auch für andere Kryptowährungen endet die Talfahrt vorerst. Alles Neue zu Bitcoin und Co. im Newsblog.",business,0,2021-05-19
2626,insideparadeplatz.ch,"UBS-Stellenabbau: Schweiz im Fokus der ""ersten Welle"" - Inside Paradeplatz. Laut Medienbericht trifft der Abbruch in der ersten Runde vor allem Banker im Heimmarkt. Total über 800 verlieren hierzulande ihre Stelle.",business,0,2021-05-19
2627,auto motor und sport,"VW ID.3 GTX (2022): Leistung, Antrieb, Markstart. In Sachen sportliche Elektro-VW geht's jetzt schnell: Der scharfe ID.3 heißt zwar noch ID.X, protzt aber mit einer 200-Kilo-Diät und Drift-Modus.",business,1,2021-05-20
2628,20 minuten,Störung : Swisspass-Kunden können keine Tickets in der SBB-App kaufen. Mehrere News-Scouts berichten von einer Störung beim Kauf von Billetts in der SBB-App. Es scheint eine Störung beim Swisspass vorzuliegen.,business,0,2021-05-20
2629,coincierge,alles wird wieder „mega-bullish“. Bitcoins Rückgang unter 40.000 Dollar sorgt bei vielen Investoren für Panik. Verschiedene Analysten relativieren den Kurs-Rücksetzer aber.,business,0,2021-05-19
2630, cash,"Börse - Krypto-Aktien: In Bitcoin investieren, ohne Bitcoins zu traden. Das Interesse von Anlegerinnen und Anlegern an Kryptowährungen wie Bitcoin, Ether oder Ripple ist gross. Statt direkt zu investieren, bieten sich Aktien mit Krypto-Bezug als Alternative an. Ein Überblick.",technology,1,2021-05-20
2631, cash,"Nachkaufen nicht möglich: Das grosse Versagen der Krypto-Börsen während des Bitcoin-Crashes / Ethereum. Als am Mittwoch die Krypto-Märkte einstürzten, hätte die Stunde von «By-the-Dip»-Investoren schlagen können. Doch die Krypto-Börsen fielen reihenweise aus. Ob das Folgen haben wird, ist noch offen.",technology,0,2021-05-20
2632, cash,"Abverkauf - Cathie Wood: ""Bitcoin befindet sich jetzt in einer Kapitulations-Phase. Das ist eine gute Zeit zum Kaufen"". Der Bitcoin-Crash hat die Karten im Krypto-Markt neu gemischt. Während Tech-Investorin Cathie Wood an ihrem 500'000-Dollar-Kursziel für Bitcoin festhält, warnen Analysten davor, auf einen kurzfristigen Rebound zu setzen.",technology,0,2021-05-20
2633, cash,+++Börsen-Ticker+++ - Wall Street startet mit Gewinnen. Die US-Börsen legen am Donnerstag zum Handelsstart leicht zu.,technology,1,2021-05-20
2634,finews.ch,Bitcoin und UBS: Kalte Dusche folgt auf Tauwetter. Der Bitcoin stürzt an den Kryptobörsen. Das bestätigt die weltweit grösste Privatbank UBS in ihrer Skepsis gegenüber Digitalwährungen. Erneut kommt dabei ein grundlegendes Problem der Banken zum Vorschein.,technology,0,2021-05-20
2635, cash,+++Börsen-Ticker+++ - SMI kann Vorbörsenkurse nicht ganz halten. Der Schweizer Aktienmarkt startet am Donnerstag mit Gewinnen. Die fallen aber nicht so hoch aus wie erwartet.,technology,1,2021-05-20
2636, cash,Kryptowährungen - Umfrage: Ist Bitcoin nun am Ende?. Nachdem dramatischen Kursrückgang singen manche schon den Schwanengesang auf die weltgrösste Kryptowährung Bitcoin. Andere sehen weitere Kursrekorde am Horizont. cash.ch fragt Leserinnen und Leser nach ihrer Meinung.,technology,0,2021-05-20
2637, cash,"+++Börsen-Ticker+++ - SMI kann Vorbörsenkurse nicht ganz halten - US-Aktienmärkte werden voraussichtlich tiefer eröffnen. Der Schweizer Aktienmarkt tendiert am Donnerstag erholt, macht den Rücksetzer des Vortages aber nur teilweise wett.",technology,0,2021-05-20
2638, cash,+++Börsen-Ticker+++ - SMI startet Erholungsversuch - Lage bei Bitcoin & Co. bleibt angespannt. Der Schweizer Aktienmarkt startet am Donnerstag mit Gewinnen. Nach dem Kursrückgang am Vortag rechnen die Händler mit einer Erholung.,technology,1,2021-05-20
2639,gmx.ch,"GNTM 2021 in der Couchticker-Nachlese: Heidi Klum wählt Kandidatin ins Finale - doch die verzichtet. In der vorletzten Folge dieser Staffel hat Heidi Klum ihre Finalistinnen gekürt. Es stand das Cover-Shooting für die ""Harper's Bazaar"" an, Gastjurorinnen waren Chefredakteurin Kerstin Schneider und Topmodel Alessandra Ambrosio. Wer schaffte es ins Finale? Die…",entertainment,0,2021-05-20
2640,nau.ch,"Prinz Harry: Meghan soll bei Diana-Ehrung dabei sein. Wegen der bevorstehenden Geburt kann Meghan nicht reisen. Sie soll trotzdem Teil der Diana-Ehrung sein, sonst bleibt auch Prinz Harry fern.",entertainment,0,2021-05-20
2641,tages-anzeiger,Nach interner Untersuchung - BBC und Reporter entschuldigen sich für Täuschung bei Diana-Interview. Die interne Untersuchung des britischen Staatssenders bringt es ans Licht: Journalist Martin Bashir hat im Vorfeld des berühmten Interviews mit Prinzessin Di im Jahr 1995 Dokumente gefälscht.,entertainment,0,2021-05-20
2642,bluewin.ch,"Weder Frau noch Mann. Film- und Popstar Demi Lovato hat sich als non-binär geoutet. Das heisst, Lovato sieht sich weder als Frau noch als Mann. Jetzt hat sie auch das Pronomen für ihre Person geändert.",entertainment,0,2021-05-20
2643,srf,"Kampf um Zuschauer - Das «Sofakino» wird teurer. Streaming als günstige Alternative zum Fernsehen, das war einmal. Die Kosten für Nutzer steigen mit der Anzahl Anbieter.",entertainment,0,2021-05-20
2644,bluewin.ch,So begegnen sich die «Friends» 17 Jahre später. Seit 2004 gab es keine neue Folge «Friends»: Nun tut sich der Cast für eine Reunion nochmals zusammen. Der erste Trailer ist da und der Zahn der Zeit hat auch an den Serienstars genagt. Eine Freude wird es trotzdem.,entertainment,1,2021-05-20
2645,20 minuten,"«Sterbe lieber zu Hause» - Salma Hayek kämpfte nach Corona-Infektion um ihr Leben. In einem neuen Interview offenbart Schauspielerin Salma Hayek, dass sie schwer an Covid-19 erkrankt sei. Sie musste zwischenzeitlich künstlich beatmet werden.",entertainment,0,2021-05-20
2646,nau.ch,Meghan Markle: Ihr Jugend-Schatz attackiert Royals – «Rassisten!». Joshua Silverstein war der erste Kuss von Royal-Aussteigerin Meghan Markle. Nun plaudert er im TV aus dem Nähkästchen und attackiert die royale Familie.,entertainment,0,2021-05-20
2647,watson,Netflix: Arnold Schwarzenegger erhält Spionage-Serie. Netflix holt Hollywood-Star Arnold Schwarzenegger (73) für eine Spionage-Serie vor die Kamera. Schwarzenegger sei als Hauptdarsteller und als ausführender …,entertainment,1,2021-05-20
2648,nau.ch,Michael Wendler: Was ist los mit Ehefrau Laura Müller?. Die sonst so fleissige Influencerin Laura Müller hat sich seit Monaten nicht zu Wort gemeldet. Fans machen sich Sorgen. Es kursieren sogar Trennungsgerüchte.,entertainment,0,2021-05-20
2649,nau.ch,Prinz Harry schwärmte früher von Papa Prinz Charles. In einem Podcast kritisierte Prinz Harry seinen Vater Charles scharf. Vor vier Jahren lobte er dessen Erziehungsfähigkeiten noch. Log er also im Interview?,entertainment,0,2021-05-20
2650,nau.ch,"Weiterer Schlag: Queen Elizabeth verliert geliebten Hund. Nur rund ein Monat nach ihrem Ehemann verliert Queen Elizabeth auch noch ihren Hund. Dieser war ein Geschenk, um sie während Philips Krankheit aufzumuntern.",entertainment,0,2021-05-19
2651,neue zürcher zeitung,"""Halston"": In der Netflix-Serie gibt Ewan McGregor den Modemacher - Neue Zürcher Zeitung. Die 1970er Jahre waren geprägt vom Gay Liberation Movement, von Hedonismus und Disco. Dann kam Aids, Abertausende verloren viel zu jung ihr Leben. Unter ihnen auch Roy Halston Frowick, dem nun eine schillernde Netflix-Serie gewidmet ist.",entertainment,0,2021-05-19
2652,srf,"Neu im Kino - «Ammonite»: Niemand knackt die Frau mit dem versteinerten Herzen. Oscarpreisträgerin Kate Winslet spielt die Hauptrolle in diesem Drama, das viele für einen lesbischen Liebesfilm halten.",entertainment,0,2021-05-19
2653,20 minuten,"Auf Nachttisch explodiert - Gwyneth Paltrow wird wegen Vagina-Duftkerze auf fünf Millionen verklagt. Gwyneth Paltrows ikonische Vagina-Kerze sorgt erneut für Aufsehen: Ein Kunde verklagt ihre Firma Goop, nachdem ein Exemplar in Flammen aufging und explodierte.",entertainment,0,2021-05-19
2654,blick,Jan Hahn (†47) heiratete kurz vor seinem Tod noch heimlich. Im Alter von 47 Jahren verstarb der RTL-Moderator Jan Hahn überraschend an Krebs. Kurz vor seinem Tod gab der dreifache Vater seiner Lebensgefährtin noch das Jawort. Seine jüngste Tochter kam erst 2019 zur Welt.,entertainment,0,2021-05-19
2655,gmx.ch,GNTM 2021 in der Couchticker-Nachlese: Heidi Klum wählt Kandidatin ins Finale - doch die verzichtet. GNTM 2021 (ProSieben) im Live-Ticker: Heidi Klum kürte offiziell ihre Finalistinnen. Eine Kandidatin schaffte es - verzichtet aber. Die Couchticker-Nachlese.,entertainment,1,2021-05-20
2656,20 minuten,"Interne Untersuchung : BBC-Journalist belog Prinzessin Diana vor legendärem Interview. Für viele Zuschauer war es eine spektakuläre Bestätigung, für das Königshaus aber ein beispielloser Tabubruch: Im Interview mit der BBC sprach Prinzessin Diana 1995 auch über Ehebruch. Für den Reporter war das Gespräch ein Coup – der auf Lügen gebaut war.",entertainment,0,2021-05-20
2657,blick,"""Frauentausch"": Lesbisches Paar auf RTL2 übel beschimpft. RTL2 sorgte mit einer Wiederholung einer Folge von «Frauentausch» für einen Skandal. Eine Teilnehmerin beleidigte ein lesbisches Paar heftig. Auf Social Media erntet der Sender nun scharfe Kritik und zieht Konsequenzen.",entertainment,0,2021-05-20
2658,blick,"Wegen Corona-Lage: Harry und Meghan planen Hilfsprojekt in Indien. Prinz Harry und Herzogin Meghan wollen helfen, die eskalierende Corona-Lage in Indien in den Griff zu kriegen. Sie planen ein Hilfsprojekt in Mumbai.",entertainment,0,2021-05-20
2659,20 minuten,"""Wo sind die Taschentücher?"". «Friends»-Fans mussten 17 Jahre darauf warten – bald ist es so weit. Ross, Rachel, Chandler, Monica, Phoebe und Joey sind wieder gemeinsam in einer Reunion-Folge zu sehen. Einen ersten Blick darauf gibts schon.",entertainment,1,2021-05-19
2660,20 minuten,Wüste Szenen in Embrach - Fussball-Junior musste mehrere Stunden operiert werden. Zu wüsten Szenen ist es nach dem Junioren-Spiel zwischen FC Embrach und FC Glattbrugg gekommen. Der FC Glattbrugg wurde temporär suspendiert.,sport,0,2021-05-20
2661,aargauer zeitung,Matchbericht - Traum von der Barrage geplatzt: FC Aarau beendet seine Saison mit einer Heimpleite gegen Lausanne-Ouchy. Der FC Aarau zeigt im letzten Spiel vor heimischer Kulisse eine enttäuschende Leistung und verliert deutlich mit 0:3 gegen Stade Lausanne-Ouchy. Damit beenden die Aarauer diese Saison auf Platz 5 der Tabelle.,sport,0,2021-05-20
2662,srf,Schwimm-EM in Ungarn – EM-Silber: Titelverteidiger Desplanches knapp geschlagen. Jérémy Desplanches hat bei der Schwimm-EM in Budapest über 200 m Lagen den 2. Platz belegt.,sport,1,2021-05-20
2663,motorsport-total.com,"Formel-1-Liveticker: Ferrari in Monaco ""ein echter Sieganwärter"". Der F1-Livetalk am Donnerstag: +++ Mick Schumachers Crash in Monaco +++ WM-Duell: Verstappen widerspricht Horner +++ ""Flexiwings"": Jetzt wird's politisch! +++",sport,1,2021-05-20
2664,20 minuten,Vorsätzlicher Mord - Maradonas Leibarzt drohen bis zu 25 Jahre Haft. Knapp ein halbes Jahr nach dem Tod von Diego Maradona hat die Staatsanwaltschaft Anklage wegen vorsätzlichen Mordes gegen das Ärzte- und Pflegeteam der argentinischen Fussball-Legende erhoben,sport,0,2021-05-20
2665,luzerner zeitung,FC Luzern: Talk vor dem Spiel gegen Lugano und dem Cupfinal - Luzerner Zeitung. Der FC Luzern steht vor dem Saisonabschluss zuhause gegen Lugano. Doch da ist ja noch das absolute Highlight: Der Cupfinal am Pfingstmontag. Diese Ausgangslage wird im Talk diskutiert.,sport,1,2021-05-20
2666,watson,"Transfer-Ticker: Patrick Rahmen bleibt Trainer beim FC Basel. Keinen wichtigen Wechsel und kein spannendes Gerücht mehr verpassen: Hol dir jetzt den watson-Transfer-Push! So einfach geht's:
Patrick Rahmen hat beim FC …",sport,1,2021-05-20
2667,srf,News aus der Super League – Rahmen erhält in Basel einen Einjahresvertrag. Hier finden Sie die wichtigsten Kurzmeldungen des Tages aus dem Schweizer Fussball-Geschehen.,sport,1,2021-05-20
