,source,content,category,sentiment,date_parsed
905,blick,"Die britische Königsfamilie gratuliert Archie zum zweiten Geburtstag. Die britische Königin zeigt durch ihre Gratulationswünsche, wie wichtig ihr die Familie ist und ein Streit nie auf den Schultern der Kinder ausgetragen werden sollte.",entertainment,1,2021-05-06
906,fm1today.ch,"Guten Morgen Deutschland» TV-Moderator Jan Hahn ist tot - FM1Today. Er war das bekannte Gesicht von RTLs «Guten Morgen Deutschland». Der TV-Moderator Jan Hahn ist im Alter von 47 Jahren gestorben. Grund für sein plötzliches Ableben ist gemäss seinem Arbeitgeber «kurze, schwere Krankheit».",entertainment,0,2021-05-06
907,watson,"Stranger Things geht in die 4. Staffel – hier der neue Teaser. Ende 2021 soll die vierte Staffel von Stranger Things starten. Wie das Abenteuer von Eleven und Co. weitergeht, verrät der neue Teaser.",entertainment,1,2021-05-06
908,20 minuten,"Kein Drama? Von wegen! - Robert De Niro hat Federer etwas verschwiegen. Der Coup von Schweiz Tourismus mit Roger Federer und Robert de Niro ist gelungen. Dabei weiss De Niro, dass die Schweiz sich bestens für Dramen eignet.",entertainment,1,2021-05-06
909,watson,«Game of Thrones»: Erste Bilder von «House of the Dragon» veröffentlicht. Game of Thrones wagt sich nochmals in die Serienwelt. Mit House of the Dragon soll die Vorgeschichte der Erfolgsserie von HBO gezeigt werden.,entertainment,1,2021-05-06
910,srf,"Neu im Kino - «Sweat»: die einsame Welt der Influencerinnen. 600'000 Instagram-Fans, keine Freunde im Privatleben: Dieser Film zeigt, warum Online-Fame nicht vor Einsamkeit schützt.",entertainment,0,2021-05-06
911,blick,Darum stieg Dieter Bohlen vom Sportwagen aufs Velo um – und zurück. Schon in jungen Jahren liebte Dieter Bohlen teure und schnelle Autos. Und auch nach seinem Rauswurf aus der Castingshow DSDS will der Poptitan auf der Überholspur bleiben – auch wenn er einst angeblich sogar aufs Velo umgesattelt hatte.,entertainment,1,2021-04-22
912,blick,"Willi Herren: Ehefrau Jasmin trauert weinend am Grab. Jasmin Herren verabschiedete sich am Donnerstag am Grab von Willi Herren. Die Schlagersängerin schaffte es zuvor nicht, zur Beerdigung ihres Ehemannes zu gehen.",entertainment,0,2021-05-07
913,20 minuten,"""Wurde einer Gehirnwäsche unterzogen"". Das Model Ashley Morgan Smithline macht den schweren Missbrauch publik, den sie angeblich durch Marilyn Manson erlebt hat. Sie ist eines von insgesamt 15 mutmasslichen Opfern.",entertainment,0,2021-05-07
914,gmx.ch,"Couchticker: GNTM-Kandidatin Dascha schafft etwas, was vor ihr noch keiner gelungen ist. GNTM (ProSieben) im Couchticker: Dascha schreibt als ""Curvy Model"" Fashion-Week-Geschichte, als sie für Designer Kilian Kerner laufen darf.",entertainment,1,2021-05-07
915,blick,Willi Herrens Geschäftspartner über Foodtruck-Brand. Zwei Wochen nach dem Tod von Willi Herren ging auch noch sein grosser Foodtruck in Flammen auf. Nun haben sich die Betreiber der «Rievkooche Bud» zu Wort gemeldet.,entertainment,0,2021-05-06
916,srf,"George Clooney wird 60 - Ein charmanter Schelm mit Herz aus Gold. Attraktiv, talentiert, witzig und grosszügig: Den Frauenschwarm George Clooney können nicht einmal die Männer hassen.",entertainment,1,2021-05-06
917,20 minuten,"""House of the Dragon"". Darauf warten «GoT»-Fans auf der ganzen Welt: Die Dreharbeiten zur Vorgeschichte der Erfolgsserie hat begonnen.",entertainment,1,2021-05-06
918,20 minuten,Tennis-Star als Fan - Roger Federer zeigt stolz seine alten Globi-Bände. Der neuste Globi-Band erinnert den Tennis-Star an seine Kindheit. Nun darf Federer gemeinsam mit dem Papagei ein Abenteuer erleben – das freut ihn.,sport,1,2021-05-07
919,blick,Ski: Slalom-Experte Henrik Kristoffersen stürzt schwer mit seinem Motocross. Slalom-Experte Henrik Kristoffersen bricht sich am Samstag beim Motocrossfahren seinen Knöchel und muss wohl oder übel eine Zwangspause einlegen.,sport,0,2021-05-07
920,speedweek.com,"Valentino Rossi: Arbeitsweise mit Munoz schon anders. Seit dem Vorjahr ist David Munoz als Crew-Chief von MotoGP-Superstar Valentino Rossi tätig. Der Yamaha-Pilot widerspricht der Kritik, er müsse sich mehr auf seine Fahrweise konzentrieren, um die Probleme zu lösen.",sport,1,2021-05-07
921,blick,Wird dieser Stürmer aus Afrika der nächste FCZ-Millionendeal?. Eine der grossen FCZ-Baustellen in dieser Saison ist der Angriff. Behebt nächste Saison ein Neuzugang aus Afrika die Sturmflaute?,sport,0,2021-05-07
922,blick,Das sind die bestbezahlten Fussball-Trainer der Welt. José Mourinho (58) übernimmt im Sommer die AS Roma – und landet damit einmal mehr einen Top-Deal! Wie steht er im Vergleich zu seinen Trainerkollegen da? Eine Übersicht.,sport,1,2021-05-07
923,bluewin.ch,35 Tage vor EM-Start: Verletzungsschock um Nati-Captain Granit Xhaka. Granit Xhaka verletzt sich am Donnerstag vor dem Halbfinal-Rückspiel der Europa League gegen Villarreal (0:0) beim Aufwärmen. Ist für den Nati-Captain nun sogar die Europameisterschaft in Gefahr?,sport,0,2021-05-07
924,eurosport de,"Federer, Nadal und Djokovic: Was passiert am Tag eins nach den Big 3? - Eurosport DE. Rafael Nadal, Novak Djokovic und Roger Federer sind noch immer die Aushängeschilder im Tennis, die seit Jahren heraufbeschworene Wachablösung bleibt aus.",sport,0,2021-05-07
925,motorsport-total.com,"Formel-1-Liveticker: Das erste Training in Barcelona jetzt live!. Der F1-Livetalk am Freitag: +++ Fliegt Bottas raus? Toto Wolff &auml;u&szlig;ert sich! +++ Kurve 10: Wie wirkt sich der Umbau aus? +++ WM-Duell: ""Bester Freitag"" f&uuml;r Mercedes +++",sport,1,2021-05-07
926,blick,"Ein Titelgewinn ohne Meisterfeier: Corona-Massnahmen verunmöglichen Party. Das lange Warten könnte heute ein Ende haben. Der EVZ steht vor dem ersten Titel-Gewinn seit 1998. In einem Heimspiel. Alles perfekt angerichtet also? Nein, denn eine Party wird es keine geben.",sport,0,2021-05-07
927,srf,3. Spiel im Playoff-Final - Krönt der EVZ seine Saison und Diaz seine Zeit in Zug?. Mit einem Sieg ist der EVZ am Freitagabend zum 2. Mal Schweizer Meister. Für Raphael Diaz wäre es der perfekte Abschied.,sport,1,2021-05-07
928,srf,WM in Calgary – Schweizer Curlerinnen auch gegen die USA erfolgreich. Die Schweizer Equipe feiert an der WM in Calgary mit einem 6:5 gegen die USA den 10. Sieg im 11. Spiel.,sport,1,2021-05-07
929,nau.ch,Box-Legende Floyd Mayweather (44) wirft Freundin aus Mega-Villa. Anfang Juni kehrt Box-Champ Floyd Mayweather (44) ein weiteres Mal aus dem Ruhestand zurück. Dieses Mal für einen Show-Kampf gegen Youtube-Star Logan Paul (26),sport,0,2021-05-07
930,bluewin.ch,"Kein rein englisches Finale – ManUtd und Villarreal stehen im Endspiel. Mit seiner ersten Finalteilnahme im Europacup verhindert Villarreal, dass beide Finals 2021 englische Angelegenheiten werden. Villarreal schaltet in den Halbfinals der Europa League Arsenal aus und wird im Final auf Manchester United treffen.",sport,0,2021-05-06
931,eurosport de,Manchester United schlägt AS Rom 8:5 nach Hin- und Rückspiel - Cavani trifft erneut doppelt - Eurosport DE. Manchester United hat sich dank Edinson Cavani im Halbfinal-Rückspiel der Europa League bei der Roma keine Blöße gegeben und ist ins Finale eingezogen.,sport,1,2021-05-06
932,blick,"Eishockey-Nati: Pius Suter kommt nicht an die WM. NHL-Stürmer Pius Suter verpasst mit den Chicago Blackhawks zwar die Playoffs, verzichtet aber auf die WM in Riga.",sport,0,2021-05-06
933,realtotal.de,"Toni Kroos kontert Chelsea-Profi Mount – Real-Stars geben sich nach CL-Aus kämpferisch - REAL TOTAL. Toni Kroos kontert Chelsea-Profi Mason Mount. Nachdem der Mittelfeldregisseur von Real Madrid im Vorfeld des Champions-League-Halbfinal-Rückspiels gemeint hatte, kein einzelner Spieler eines Kontrahenten würde ihm schlaflose Nächte bereiten, fühlte Mount sich…",sport,0,2021-05-06
934,blick,"Granit Xhaka und Arsenal mit Horror-Abend in Europa League. So hat sich Granit Xhaka (28) den Europa-League-Abend nicht vorgestellt: Verletzung beim Einschiessen, Out im Halbfinal gegen den Ex-Boss und dann versuchen Arsenal-Fans auch noch, das Stadion zu stürmen.",sport,0,2021-05-07
935,blick,Floyd Mayweather vs. Logan Paul: Hitzige Stimmung einen Monat vor Kampf. In einem Monat wollen sie sich die Köpfe einschlagen: Box-Champion Floyd Mayweather und Entertainer Logan Paul. Die Stimmung ist schon jetzt richtig hitzig.,sport,0,2021-05-07
936,blick,"Sky-Experte Dennis Aogo mit Skandal-Aussage bei Champions League. Dennis Aogo (34) wird zuerst Opfer eines Rassismus-Skandals, dann gerät er selbst ins Kreuzfeuer der Kritik. Wegen einer unentschuldbaren Aussage, die er noch am gleichen Abend tätigt.",sport,0,2021-05-07
937,blick,"Die EVZ-Schlüsselspieler: Genoni, Diaz, Kovar, Simion, Hofmann. Mit einer Hand am Pokal, in der anderen drei Matchpucks dafür. Wer die entscheidenden Rollen spielt, dass der EVZ am Freitag seine nahezu perfekte Saison mit dem Titel krönen kann.",sport,1,2021-05-06
938,bild,"Inzidenz unter 100: Das ist der Corona-Fahrplan in den Berliner. Wenn die Inzidenz so wie Freitag unter der entscheidenden 100er-Grenze bleibt, kann in Berlin schon am kommenden Freitag die Außengastronomie wieder öffnen.",science,0,2021-05-07
939,focus online,"Hitzeknaller in Deutschland! Wo es an Muttertag 30 Grad heiß wird. Endlich mal ein Sturmtief, das positive Auswirkungen hat. Denn Tief Hubertus bleibt vor Westeuropa stehen und weht warme bis heiße Luft nach Deutschland. Der kommende Sonntag, also Muttertag, wird ein Sommertag wie aus dem Bilderbuch. Die Werte steigen auf bi…",science,1,2021-05-07
940,die welt,Corona in Zahlen: Sehen wir den Effekt der Ausgangssperre?. Seit zwei Wochen fällt die Sieben-Tage-Inzidenz rapide. Befürworter der „Bundes-Notbremse“ sehen sich bestätigt. Doch Experten können keine eindeutige Wirkung der umstrittenen Ausgangssperren nachweisen. Das gesteht auch ein Unterstützer der Maßnahme ein.,science,0,2021-05-07
941,bild,"Corona-Inzidenz sinkt: Brandenburg plant Lockerungen ab Pfingsten. Weil die Corona-Inzidenz landesweit sinkt, will Brandenburg ab 22. Mai wieder Außengastronomie und Tourismus erlauben.",science,0,2021-05-07
942,die welt,"Super Recognizer: Die besondere Gabe, Gesichter wiederzuerkennen. Wenn sogenannte Super Recognizer ein Gesicht gesehen haben, behalten sie dies lange im Gedächtnis und können es wiedererkennen. Ein Psychologe erforscht Menschen mit dieser Fähigkeit – und hilft auch der Polizei.",science,1,2021-05-07
943,faz - frankfurter allgemeine zeitung,"Fiktive Teilchen für die Elektronik von morgen. Was passiert, wenn sich Elektronen mit Lücken im Kristallgitter verbinden? Diese ungewöhnliche Liaison, Exziton genannt, soll neuartige Halbleiterbauteile ermöglichen. Die Voraussetzung sind geschaffen,",science,1,2021-05-07
944,der spiegel,"Studie: Bildung schützt nicht vor Schrumpfung des Gehirns. Schützen Abitur, Studium und vielleicht noch Promotion davor, dass unser Gehirn im Laufe unseres Lebens zunehmend kleiner wird? Nein, zeigt eine Studie. Bildung habe aber einen anderen messbaren Effekt aufs Gehirn.",science,0,2021-05-07
945,faz - frankfurter allgemeine zeitung,Der „Pflexit“ bleibt aus. Deutschland verliere in der Corona-Krise Tausende Pflegekräfte: Diese Nachricht sorgte für viel Wirbel. Zahlen der Bundesagentur für Arbeit zeigen das Gegenteil – die Beschäftigung steigt.,science,0,2021-05-07
946,t-online,"Inzidenz unter 100: Welche Corona-Lockerungen in Berlin anstehen. Die Sieben-Tage-Inzidenz in Berlin sinkt fast täglich. Setzt sich diese Entwicklung fort, könnten bald erneut Lockerungen in Kraft treten. Lesen Sie hier, was dann in der Hauptstadt gilt.",science,0,2021-05-07
947,futurezone.at,Gigantisches Teleskop auf dem Mond: Plan wird konkreter. Das Lunar Crater Radio Telescope (LCRT) könnte uns einen Blick in das „kosmische Mittelalter“ erlauben.,science,1,2021-05-07
948,wetter.de,"Supermond, Merkur & Sternschnuppen - wann lohnt sich ein Blick in den Mai-Himmel besonders? - Wetter.de. Einige Highlights hat  der Mai am Sternenhimmel zu bieten. Der Höhepunkt der Eta-Aquariiden steht bevor. Doch wie gut werden wir sie sehen können.",science,1,2021-05-07
949,die welt,"Corona-Tote: US-Forscher schätzen Zahl weltweit auf 6,9 Millionen. Ein US-Forscherteam geht davon aus, dass es bei der Erfassung der Corona-Toten in fast jedem Land der Welt signifikante Lücken gibt. Besonders groß soll diese in Russland sein. Deutschlands Statistiken hingegen sollen vergleichsweise gut sein.",science,1,2021-05-07
950,heise online,Zelle mit künstlichem Erbgut teilt sich erstmals wie natürliche Zellen. Vor fünf Jahren erschuf Craig Venter die erste künstliche Zelle. Nun gelang Forschern der Durchbruch: die erste vollsynthetische Zelle vermehrt sich.,science,1,2021-05-07
951,der spiegel,"Entscheidungsmüdigkeit bei Banken: Warum Sie einen Kredit nicht zur Mittagszeit beantragen sollten. Müde und gestresste Mitarbeiter machen sich Entscheidungen gern leicht, wissen Psychologen. Das zeigte sich in einer Studie auch bei Mitarbeitern einer Bank – und hatte Auswirkungen auf die Kreditvergabe.",science,0,2021-05-07
952,der spiegel,SPIEGEL Daily Podcast: Vom Brennpunkt zum Hotspot: Wie Armut die Coronainzidenz hochtreibt. Die einen leben mit Schimmel in der Wohnung und Ratten vor der Tür. Die anderen halten Abstand auf herrschaftlichen Anwesen. Wie genau beeinflussen Armut und Reichtum die Coronainzidenz? Ortsbesuch in einem Kölner Villenviertel und in einer Hochhaussiedlung.,science,0,2021-05-07
953,die welt,Corona Deutschland: RKI registriert 18.485 Neuinfektionen und 284 Tote. In der Schweiz geht die Zahl der gemeldeten Corona-Infektionen zurück – und das trotz weitreichender Lockerungen der Coronamaßnahmen. Die Inzidenz in Deutschland sinkt weiter. Ein Überblick in Zahlen und Grafiken.,science,0,2021-05-07
954,t-online,"RKI registriert rund 18.500 Corona-Neuinfektionen – Inzidenzwert sinkt auf 125,7. Die Gesundheitsämter melden erneut einen deutlichen Rückgang bei den Corona-Fallzahlen im Vergleich zur Vorwoche. Auch die Sieben-Tage-Inzidenz sinkt weiter. Die Zahl der Todesfälle aber bleibt weiterhin hoch.",science,1,2021-05-07
955,scinexx | das wissensmagazin,"Neuer Rekord der Laserintensität - Physiker erzeugen erstmals Laserpulse mit 100 Trilliarden Watt pro Quadratzentimeter. Strahlender Meilenstein: Forscher haben ein Lasersystem mit zuvor unerreichter Intensität konstruiert. Die Energie der ultrakurzen, auf gut einen",science,1,2021-05-06
956,fr.de,Schwarzes Loch nahe der Erde entdeckt - Forschende nennen es „Einhorn“. Das kleinste bekannte schwarze Loch bekommt den Namen „Einhorn“ verpasst. Es ist gar nicht weit von der Erde entfernt – in astronomischen Dimensionen.,science,0,2021-05-06
957,futurezone.at,"Mars-Rover zeigt episches 360-Grad-Panorama mit Zoomfunktion. Der Curiosity-Rover hat ein spektakuläres Panoramabild aufgenommen, das den Gale-Krater zeigt.",science,1,2021-05-06
958,frankfurter rundschau,Sensationelle Aufnahmen aus dem Weltall zeigen Entstehung eines jungen Planeten. Wie entstehen Planeten und Planetensysteme? Eine Aufnahme aus dem All könnte Licht ins Dunkel bringen. Es handelt sich um den jüngsten bis dato abgebildeten Exoplaneten.,science,1,2021-05-06
959,scinexx | das wissensmagazin,"Exotische Supernova gibt Rätsel auf. Unerklärliche Explosion: Astronomen haben eine Supernova entdeckt, deren Ablauf und Ursachen mit gängigen Modellen nicht erklärbar sind. Denn der zufällig",science,0,2021-05-06
960,futurezone.at,"Mars-Rover entdeckt ""lustige"" Steine. Der Perseverance Rover liefert regelmäßig hochauflösende Bilder vom Mars. Darauf sind so manches Mal lustige Steine zu erkennen.",science,1,2021-05-06
961,augsburger allgemeine,"Locker in den Frühling: Übungen für Bauch, Beine und Po. Bei den Übungen für zu Hause von Ingrid Mayr vom FC Weisingen werden außerdem der Rücken und die Schultern trainiert. Nur 15 Minuten reichen für das Training...",health,1,2021-05-07
962,t-online,Meniskusriss: Späte Behandlung fördert Arthrose. Ein Meniskusriss gehört zu den häufigsten Knieproblemen. Er verursacht starke Schmerzen und kann Arthrose fördern. Wann ein Meniskusriss operiert werden muss und was gegen die Knieschmerzen hilft.,health,0,2021-05-07
963,lifepr.de,"Hantavirus-Fälle nehmen 2021 rasant zu, Proplanta GmbH & Co. KG, Pressemitteilung - lifepr.de. Proplanta GmbH & Co. KG, Laut neuesten Zahlen des Robert Koch Instituts (RKI) und Auswertungen von Proplanta haben sich in Deutschland bislang 47…",health,0,2021-05-07
964,heilpraxisnet.de,"Hautveränderungen bei Covid-19: Vom Nesselausschlag bis zu COVID-Zehen. COVID-19 kann sich durch Hautausschläge äußern Bei vielen Viruserkrankungen wie beispielsweise bei Masern, Röteln, Papillom oder Herpesviren bietet die Haut deutliche Anzeichen für eine Infektion. Auch bei COVID-19 weisen manche Infizierte Hautbeschwerden auf…",health,0,2021-05-07
965,vestorscapital.com,"Pharmabranche: Zur Innovation verdammt - Vestors Capital Magazin. Das Online-Portal des Wirtschaftsmagazins Capital mit Reportagen, Analysen, Kommentaren aus der Welt der Wirtschaft und der persönlichen Finanzen.",health,1,2021-05-07
966,t-online,"Corona: Mediziner warnen vor plötzlichem Symptom – Selten, aber unterschätzt. Die Liste der möglichen Langzeitfolgen bei Covid-19 ist lang. Neue Studien zeigen, dass offenbar auch Probleme mit den Ohren zu den bleibenden Symptomen gehören können.",health,0,2021-05-07
967,augsburger allgemeine,"Bei Blinddarmentzündung schnell handeln. Eine Blinddarmentzündung verläuft meist harmlos und kann mit einem kurzen Eingriff schnell behandelt werden. Wer zu lange zögert, zum Arzt zu gehen, setzt sich...",health,0,2021-05-07
968,augsburger allgemeine,"Einen Zahn retten - Wann eine Wurzelbehandlung ratsam ist. Vor kaum einer anderen Behandlung graut es Patienten beim Zahnarzt mehr als vor einer an der Zahnwurzel. Sie sind jedoch oft die letzte Option, um einen Zahn zu...",health,0,2021-05-07
969,echo24.de,"Corona: Forschungs-Paukenschlag - ganz andere Krankheit, als gedacht - op-online.de. Corona wurde aufgrund seiner Symptome bislang für ein Erkältungsvirus gehalten. Forscher kommen nun zu der überraschenden Erkenntnis, dass alles anders ist.",health,0,2021-05-07
970,augsburger allgemeine,"Ständig kalte Füße im Büro: Erkältungsursache liegt woanders. Mancher hat im Büro ständig kalte Füße und Hände. Viele vermuten dann, dass darin die Ursache für eine Erkältung liegt. Doch das ist nicht der Fall, sagt...",health,0,2021-05-06
971,augsburger allgemeine,"Milben lassen Brombeeren vertrocknen - Rapsöl hilft. Mit dem ersten Austrieb am Brombeerstrauch wird auch die Brombeergallmilbe wieder aktiv. Für das bloße Auge ist der rund 0,2 Millimeter kleine Schädling nicht...",health,0,2021-05-06
972,augsburger allgemeine,"Schlafkrankheit in Ostafrika: Vor Tsetse-Fliegen schützen. Safaribegeisterte aufgepasst: Neben Malaria gibt es auch noch andere lebensgefährliche Krankheiten, die über Mücken und Fliegen übertragen werden. Zum Beispiel...",health,0,2021-05-06
973,augsburger allgemeine,"Wann erkältete Babys zum Arzt sollten. Babys schniefen und husten, wenn sie sich erkältet haben. Das ist im Winter nicht ungewöhnlich. Verweigert ein Säugling aber die Nahrung oder bekommt blaue...",health,0,2021-05-06
974,augsburger allgemeine,"AB0, Rhesus, Kell: Die eigene Blutgruppe kennenAB0, Rhesus, Kell. A, B, AB oder 0? Rhesus positiv oder negativ? Viele Menschen kennen ihre Blutgruppe nicht. Müssen sie auch nicht zwingend. Denn bei Bedarf testen Ärzte ohnehin...",health,0,2021-05-06
975,augsburger allgemeine,"Im Herbst lässt sich gut Knospenheide aufs Grab setzen. Eine Sondergruppe der Besenheide hat es Friedhofsgärtnern besonders angetan: Da sich Knospenblüher bis in den Winter halten, empfehlen sie diese für die...",health,1,2021-05-06
976,augsburger allgemeine,"Bei Arthrose können Radeln oder Schwimmen die Schmerzen lindern. Bei Arthrose ist Aktivität wichtig. Geeignet sind vor allem Bewegungsformen, die sanft mit den Gelenken umgehen. Andere Sportarten sind dagegen Gift für den...",health,1,2021-05-06
977,fitbook.de,Die positiven Wirkungen der Mittelmeer-Diät auf die Gesundheit - FITBOOK. Welchen Effekt hat die Mittelmeer-Diät bzw. mediterrane Ernährung auf die Gesundheit? Dies haben viele Studien untersucht. Ein Überblick.,health,1,2021-05-06
978,heilpraxisnet.de,"Hautveränderungen bei Covid-19: Vom Nesselausschlag bis zu COVID-Zehen. Bei vielen Viruserkrankungen wie beispielsweise bei Masern, Röteln, Papillom oder Herpesviren bietet die Haut deutliche Anzeichen für eine Infektion. Auch bei COVID-19 weisen manche Infizierte Hautbeschwerden auf, wie beispielsweise die rätselhaften „COVID-Zehen“. Was ist über den Zusammenhang zwischen Coronavirus-Infektionen und Hautveränderungen bekannt?",health,0,2021-05-07
979,heilpraxisnet.de,"COVID-19: Völlig andere Krankheit als bisher angenommen wurde. Bei COVID-19 scheint es sich um eine Gefäßerkrankung zu handeln, und nicht etwa um eine Art Atemwegserkrankung, welche durch ein Erkältungsvirus hervorgerufen wird. Die neuen Erkenntnisse helfen, die Vielzahl der scheinbar unzusammenhängenden Komplikationen von COVID-19 zu erklären und könnten eventuell die Entwicklung neuer Therapien ermöglichen.",health,0,2021-05-07
980,deavita,Alzheimer vorbeugen mit Ernährung. Viele unterschätzen den Einfluss von Lebensmitteln auf die Gehirngesundheit. Sie können auch Krankheiten wie Alzheimer vorbeugen mit Ernährung,health,0,2021-05-07
981,heilpraxisnet.de,"Die richtige Ernährung scheint vor Alzheimer und Demenz zu schützen. Eine Ernährung, die reich an Fisch, Gemüse und Olivenöl ist, kann das Gehirn möglicherweise vor Krankheitsauslösern schützen, die im Zusammenhang mit der Entstehung von Demenz und Alzheimer stehen, wie ein deutsches Forschungsteam in einer aktuellen Studie zeigt.",health,1,2021-05-06
982,srf,"Britische Regionalwahlen - Regierungspartei SNP erklärt sich zur Siegerin in Schottland. Sie werde ein Gesetz für ein neues Referendum einbringen, kündigte Regierungschefin Nicola Sturgeon an.",world,1,2021-05-08
983,telebasel,"Europa-Park hofft auf Öffnung vor Pfingsten. Der Europa-Park bereitet sich auf eine baldige Öffnung vor. Man hoffe, dass man noch vor den Pfingsten wieder Gäste empfangen kann.",world,1,2021-05-08
984,srf,"""Washington Post""-Bericht - Trump-Regierung beschaffte heimlich Reporter-Daten. Die Journalisten hätten zu Beginn der Trump-Regierung über Russlands Rolle im Wahlkampf 2016 berichtet, so die Zeitung.",world,0,2021-05-08
985,blick,Paare trennen sich nach mehreren Jahrzehnten. Bill und Melinda Gates sind nicht allein. Auch andere prominente Paare trennten sich nach mehreren Jahrzehnten und wagten jeder für sich den Schritt in die Unabhängigkeit.,world,0,2021-05-08
986,blick,"Europapark im Lockdown: Kommt die Wiedereröffnung bereits vor Pfingsten?. Der Europapark bereitet sich auf eine baldige Öffnung vor, heisst es auf Anfrage von Blick. Wann der Lockdown tatsächlich vorbei ist, hänge aber noch von ein paar Faktoren ab, die nicht in der Hand des Freizeitparks lägen. Die Details.",world,0,2021-05-08
987,srf,Wahlen in Grossbritannien - Die Coronakrise hat Johnsons Konservativen geholfen. Labour versinkt indes weiter: Deren Oppositionspolitik während der Pandemie kam bei den Wählenden nicht gut an.,world,0,2021-05-08
988,20 minuten,"Coronavirus : Australien wird womöglich bis Ende 2022 keine Touristen ins Land lassen. Planst du Ferien in Australien? Das könnte schwierig werden. Australiens Grenzen könnten bis Ende 2022 geschlossen bleiben, sagt der Tourismusminister des Landes.",world,0,2021-05-08
989,telebasel,Grünes Impfzertifikat für Europa soll im Juni starten können. Das Coronavirus stellt die Schweiz und die Welt auf den Kopf. Hier im Ticker bleiben Sie über die aktuellen Ereignisse auf dem Laufenden.,world,1,2021-05-08
990,20 minuten,Gewaltausbruch in Favela : Zahl der Toten bei Polizeieinsatz in Rio de Janeiro steigt auf 28. Die Zahl der Toten nach einem der blutigsten Polizeieinsätze in der Geschichte der brasilianischen Millionenmetropole Rio de Janeiro ist offensichtlich auf 28 gestiegen.,world,1,2021-05-08
991,neue schweizer zeitung,"Zoom hat Zugriff auf die Kamera-API des iPad. Der App-Entwickler Jeremy Provost hat festgestellt, dass Apple Zoom Zugriff auf die Kamera-API des iPad gewährt hat. Mit Ausnahme der FaceTime-App von",world,1,2021-05-08
992,srf,2:0-Erfolg in Lugano - Vaduz mit Ansage im Kampf gegen den Abstieg. Die Liechtensteiner reisen mit 3 Punkten im Gepäck aus Lugano ab. Sie könnten wegweisend sein für den Klassenerhalt.,world,1,2021-05-08
993,srf,"Diskussionen innerhalb der SP - Rahmenabkommen: Ex-Regierungsrat redet von ""Wahrnehmungsstörung"". Das Rahmenabkommen sorgt in der SP für Diskussionen. Immer mehr Stimmen betonen die Vorteile des Abkommens.",world,0,2021-05-08
994,blick,Drama um Schlagerstar: Jetzt sprich Stefan Mross Mutter über die Killer-Tat. Die Cousine (†50) und die Tante (†76) von Volksmusiker Stefan Mross wurden ermordet. Jetzt spricht seine Mutter über die schreckliche Tat.,world,0,2021-05-08
995,srf,Gegen Corona-Massnahmen - Rund 1500 Personen an unbewilligter Demo in Aarau. Die Polizei war mit einem Grossaufgebot vor Ort. Die Demonstrierenden zogen in Gruppen mehrfach durch die Stadt.,world,0,2021-05-08
996,blick,Fast zwei Drittel sind für den Rahmenvertrag mit der EU. Unangenehmer Befund für den Bundesrat: 64 Prozent der Stimmberechtigten unterstützen das institutionelle Abkommen mit der EU.,world,0,2021-05-08
