source,title,description,category,publishedAt
Schweizer Radio und Fernsehen (SRF),Jagd in Rumänien - Liechtensteiner Prinz Emanuel erlegt grössten Braunbären Europas,Er hatte für die Jagd eine Sonderbewilligung erhalten. Die rumänische Polizei hat eine Untersuchung eröffnet.,world,2021-05-06T20:05:00Z
BLICK,Herzige Anekdote erfunden: Flunkert Joe Biden jetzt etwa schon wie Trump?,"Jahrelang pendelte US-Präsident Joe Biden (78) mit der Bahn zwischen seinem Zuhause und seiner Arbeit. Zum 50. Jubiläum der US-Bahn-Firma Amtrak erzählte aber er eine Geschichte, die so nicht stimmen kann. Und das nicht zum ersten Mal.",world,2021-05-06T15:54:26Z
BLICK,Deutschland: Sofagate: Laut Türkei ist EU verantwortlich,Der türkische Aussenminister Mevlüt Cavusoglu sieht die Verantwortung für einen Eklat um die Sitzordnung bei dem Türkeibesuch von EU-Kommissionschefin Ursula von der Leyen im April klar in Brüssel.,world,2021-05-06T14:36:45Z
20 Minuten,Am Tag des Scheidungsantrags,Das Vermögen von Bill und Melinda Gates wird anhand einer Trennungsvereinbarung aufgeteilt. Er soll ihr bereits Aktien in Milliardenhöhe übertragen haben.,world,2021-05-06T13:37:30Z
BLICK,Wegen aufgemalter Maske: Bali schmeisst Russin von der Insel,Die Russin Leia Se (25) erlaubte sich auf Bali einen üblen Scherz. Sie malte sich eine Gesichtsmaske auf und betrat so einen Laden. Die Aktion wurde gefilmt und die Influencerin bekam prompt Ärger – und wie.,world,2021-05-06T13:28:50Z
20 Minuten,Polizist getötet – US-Studenten müssen lebenslänglich ins Gefängnis,Nach einem gescheiterten Drogendeal kam es im Sommer 2019 zu einer Auseinandersetzung zwischen zwei Beamten und zwei Touristen im Alter von 18 und 19. Sie endete tödlich.,world,2021-05-06T11:24:29Z
BLICK,Deutscher Bundestag stimmt für Impf-Freiheiten,Der Deutsche Bundestag hat Lockerungen für Corona-Geimpfte beschlossen. Eine Verordnung der Bundesregierung wurde mit grosser Mehrheit befürwortet.,world,2021-05-06T11:20:16Z
20 Minuten,Tierquälerei : «Die Socke lag eng und sehr tief an»,"In der Hauptstadt der westenglischen Grafschaft Lincolnshire ist ein Schwan gefunden worden, dem eine Socke über Kopf und Hals gestülpt worden war. Die Polizei will der Gerechtigkeit genüge tun.",world,2021-05-06T10:36:30Z
BLICK,Pentagon besorgt wegen unkontrolliertem Absturz chinesischer Rakete,Das US-Verteidigungsministerium verfolgt mit Sorge die offenbar unkontrollierte Rückkehr einer chinesischen Weltraum-Rakete vom Typ Langer Marsch zur Erde.,world,2021-05-06T07:38:53Z
BLICK,US-Student tötete Beamten in Rom: Polizisten-Mörder kriegt lebenslänglich,Im Sommer 2019 tötete der Amerikaner Finnegan Lee Elder einen Polizisten (†35) in Rom. Hintergrund der Tat war ein geplatzter Koks-Deal. Nun ist das Urteil gefallen – der Amerikaner und sein beteiligter Kollege müssen lebenslang ins Gefängnis.,world,2021-05-06T06:33:31Z
20 Minuten,Strafbefehl gegen Tobias Steiger,Die Kundgebung der rechtsextremen Partei national orientierter Schweizer (Pnos) vom November 2018 in Basel bleibt vor allem wegen der massiven Gegendemonstration in Erinnerung. Nun gibt es eine erste Sanktion gegen den damaligen Basler Pnos-Chef.,world,2021-05-06T17:43:10Z
20 Minuten,«Bachelor»-Francesca nach Nacktfoto-Leak : «Ich habe keine Angst vor Slut-Shaming»,Zwei Männer haben exklusive Nacktfotos des Onlyfans-Accounts von «Bachelor»-Gewinnerin Francesca geleakt. Sie hat nun Anzeige erstattet.,world,2021-05-06T17:07:47Z
Schweizer Radio und Fernsehen (SRF),Patentfreigabe für Impfstoffe - USA stürzen Europa ins Patentschutz-Dilemma,Eine vage Ankündigung aus Washington verleiht der weltweiten Debatte über den Patentschutz völlig neuen Schwung.,world,2021-05-06T15:57:00Z
20 Minuten,Gefahr aus dem All,"Im Westen warnen Experten vor Trümmern, die zwischen Dienstag und Freitag zur Erde stürzen dürften. China nehme diese Gefahr bewusst in Kauf, so ein Astrophysiker.",world,2021-05-06T15:45:21Z
20 Minuten,Er wurde 47 Jahre alt,Der Moderator von «Guten Morgen Deutschland» ist am Dienstag nach schwerer Krankheit gestorben.,world,2021-05-06T15:23:22Z
aeroTELEGRAPH,Swiss-Abbau trifft auch Helvetic Airways,Swiss muss mehr sparen und verkleinert die Flotte deutlich. Das heißt auch für die Wet-Lease-Partnerin Helvetic Airways weniger Aufträge.,world,2021-05-06T15:22:00Z
Schweizer Radio und Fernsehen (SRF),Prozess im Kanton Solothurn - Vater wegen vorsätzlicher Tötung seines Babys freigesprochen,"Es ist ein Fall, der sich – trotz verdeckten Ermittlungen – vor allem auf Indizien stützt. Nun ist ein Urteil gefällt.",world,2021-05-06T14:24:00Z
docma,Leica Vario-Elmarit-SL 1:2.8/24-70 ASPH - Vollformat-Zoomobjektiv für L-Mount,"Photoshop Tutorials - Profi Tipps für Bildbearbeitung mit Photoshop: Fotocollage erstellen, Bilder freistellen, retuschieren, u.v.m. - DOCMA Magazin für digitale Bildbearbeitung",world,2021-05-06T14:12:58Z
20 Minuten,«Football Inside» : Schweizer Fussball-Doku – Kriens-Trainer auf den Spuren von Pep Guardiola,Dokus wie «All or nothing: Man City» oder «Sunderland till I die» besorgten Amazon und Netflix echte Kassenschlager. Nun kommt mit «Football Inside» ein Film über das Kabinenleben bei Schweizer Fussballclubs in die Kinos.,world,2021-05-06T14:00:00Z
20 Minuten,Kein Drama? Von wegen!,"Der Coup von Schweiz Tourismus mit Roger Federer und Robert de Niro ist gelungen. Dabei weiss De Niro, dass die Schweiz sich bestens für Dramen eignet.",world,2021-05-06T14:00:00Z
Www.srf.ch,Das Neueste zur Coronakrise - Deutschland: Astra-Zeneca-Vakzin für alle Erwachsene möglich,"Impfstoffe könnten nicht die einzige Antwort auf die Krankheit sein, so EU-Gesundheitskommissarin Stella Kyriakides.",world,2021-05-06T20:37:23Z
Www.nau.ch,"Uni Zürich findet Biomarker, der schwere Corona-Verläufe vorhersagt","Forschende der Uni Zürich haben einen Anhaltspunkt ermittelt, der voraussagt, ob ein Corona-positiver Mensch einen schweren Krankheitsverlauf haben wird.",world,2021-05-06T18:37:00Z
Www.nzz.ch,Frankreich - Grossbritannien: Eskalation im Fischereistreit - Neue Zürcher Zeitung,Vor dem Hafen der britischen Kanalinsel Jersey demonstrieren französische Fischer. Anlass ist der Konflikt um Fischereirechte nach dem Brexit. Grossbritannien und Frankreich haben je zwei Patrouillenboote in die Region entsandt.,world,2021-05-06T17:51:13Z
Tagblatt.ch,Chlordioxid - Weltweit tätiger «Coronawunderheiler» mit Firmennetz im Rheintal propagiert dubioses Allheilmittel,"Chlordioxid gilt in der Esoterikszene als angebliches Allheilmittel: Der deutsche «Biophysiker» Andreas Kalcker steuert dessen Verbreitung von seinem Werdenberger Wohnsitz aus. Sein Netzwerk umfasst mehrere Firmen, Vereine und Personen mit Adressen im St.Gall…",world,2021-05-06T16:23:09Z
20 Minuten,Details zum zweiten Geburtstag - Archie hat ein Zoom-Date mit der Queen und seinen Cousins,"Archie wird zwei. Neben einer BBQ-Party mit Schoggibrunnen gibts einen Video-Call mit der Queen sowie George, Charlotte und Louis.",world,2021-05-06T13:43:40Z
Blick.ch,"In Zürich, Basel, Genf ist das Risiko einer Immobilienblase am grössten","In den Grosszentren Zürich, Basel, Genf und Lausanne ist das Blasenrisiko am grössten. Aber auch im Tessin, im Wallis und im Kanton Neuenburg steigt die Gefahr.",world,2021-05-06T13:28:00Z
20 Minuten,Invasive Tierart - Marderhunde können Wirte für Sars-CoV-2 sein und das Virus übertragen,In unseren Breitengraden sind Marderhunde aus verschiedenen Gründen nicht gern gesehen. Forschende liefern nun einen weiteren: Sie können dem Menschen gefährlich werden.,world,2021-05-06T13:02:53Z
Www.srf.ch,Protestaktion gegen Vatikan – Trotz Verbot: Katholischer Seelsorger segnet Homosexuelle,Der Zürcher Meinrad Furrer will queere Paare erstmals öffentlich segnen. Der Churer Bischof ist skeptisch.,world,2021-05-06T11:23:00Z
Itreseller.ch,Sony stellt den Verkauf von DSLR-Kameras ein - IT Reseller - IT Reseller,Sony beendet die Ära der Spiegelreflexkameras und stellt den Verkauf der letzten Modelle nach rund 15 Jahren im Geschäft ein. Das letzte Modell wurde 2016 vorgestellt.,world,2021-05-06T11:22:26Z
Www.srf.ch,Keine Partie gegen Frankreich – Auch Nati-Testspiel am Freitag abgesagt,Nach dem Spiel am Dienstag fällt auch der Test der Schweizer Eishockey-Nati gegen Frankreich am Freitag ins Wasser.,world,2021-05-06T10:36:00Z
Blick.ch,Corona-Impfung: Schweiz bestellt nochmals sieben Milllionen Moderna-Dosen,Die Schweiz hat mit Moderna erneut einen Vertrag über sieben Millionen Impfdosen abgeschlossen. Diese sollen 2022 geliefert werden – und so eine allenfalls nötige Auffrischung der Corona-Impfung sichern.,world,2021-05-06T10:13:10Z
Onlinemarketing.de,Zu ehrliche Ads: Signal von Facebook gesperrt? - OnlineMarketing.de,"Um auf Facebooks Datenschutzmängel hinzuweisen, startete Signal eine gewagte Werbekampagne. Facebook hingegen bestreitet die Echtheit der Ads.",world,2021-05-06T09:15:13Z
