source,title,description,category,publishedAt
Schweizer Radio und Fernsehen (SRF),Gewalt im Nahen Osten - Raketenalarm und Tote in Tel Aviv - Lage eskaliert weiter,Im Stadtzentrum waren mehrere Explosionen zu hören. Bislang ist ein Todesfall in der Nähe Tel Avivs bestätigt.,technology,2021-05-11T19:28:00Z
BLICK,Angeblicher Verstoss gegen Corona-Regeln: Geissens aus Pizzeria geworfen,Dicke Post für die Geissens: Bei einem Abendessen wurde die TV-Familie aus einer Kölner Pizzeria geworfen. Grund dafür: Sie sollen gegen Corona-Auflagen verstossen haben.,technology,2021-05-11T19:25:20Z
Schweizer Radio und Fernsehen (SRF),Neue Banking-App - Wie Postfinance die Jungen zum Anlegen lockt,Die neuste Schweizer Banking-App «Yuh» von Postfinance und der Swissquote Bank zielt auf junge Anlegerinnen und Anleger.,technology,2021-05-11T19:09:00Z
20 Minuten,Eskalation des Konflikts : Israels Luftwaffe zerstört Hochhaus in Gaza – Frau nahe Tel Aviv getötet,"Bei einem Luftangriff im Gazastreifen ist ein Hochhaus so stark beschädigt worden, dass es komplett einstürzte. Im Gebäude befanden sich mehrere Büros der radikalislamischen Hamas.",technology,2021-05-11T18:32:16Z
Schweizer Radio und Fernsehen (SRF),34. Runde der Super League - 2:0-Sieg in Vaduz: YB sichert sich Vorsprung-Rekord,YB gewinnt erstmals seit 2015 wieder bei Vaduz und wird die Saison mit dem grössten Vorsprung der SL-Geschichte beenden.,technology,2021-05-11T18:20:00Z
Schweizer Radio und Fernsehen (SRF),Auftakt EM-Qualifikation - Wahnsinns-Wende: Volleyballerinnen ringen Estland nieder,Die Nati macht im Entscheidungssatz einen 8:13-Rückstand wett. Schon am Mittwoch geht es in Minsk weiter.,technology,2021-05-11T17:23:00Z
BLICK,Puerto Rico: Geschäftsmann (60) erschiesst Hund auf Golfplatz,"In Puerto Rico hat sich ein Hund heimlich auf einen Golfplatz geschlichen – mit fatalen Folgen: Weil sich das Tier dort den Ball eines Spielers schnappte, wurde es erschossen.",technology,2021-05-11T16:35:49Z
Schweizer Radio und Fernsehen (SRF),Schulmassaker nach Ferienende - 19-Jähriger tötet neun Menschen an russischer Schule,Ein Mann hat an einer Schule in der russischen Stadt Kasan mindestens neun Menschen erschossen. Er wurde verhaftet.,technology,2021-05-11T15:25:00Z
20 Minuten,J.Lo und Ben Affleck sollen gemeinsam in den Ferien gewesen sein,Gerüchte um ein Liebes-Comeback zwischen Jennifer Lopez und Ben Affleck werdern immer lauter. Paparazzi erwischten die beiden am Wochenende in Montana.,technology,2021-05-11T15:23:00Z
BLICK,Marvin Wildhage lässt Influencerin Enisa Bukvic auffliegen,"Youtuber Marvin Wildhage testet mit einer Fake-Gesichtscreme, wie genau es Influencer mit der ihrer Werbung nehmen – und entlarvt so schwarze Schafe.",technology,2021-05-11T15:06:53Z
BTC-ECHO,"Tagessieger: Fünf Top-50 Coins, die den Bären die Stirn bieten","Viele, aber nicht alle Top-50-Coins sehen heute rot. Ein Blick auf die fünf Top-Performer vom 11. Mai.",technology,2021-05-11T16:05:00Z
BTC-ECHO,Was steckt hinter dem Hype um Internet Computer (ICP)?,"Das Internet zu revolutionieren, ist ein ehrgeiziges Vorhaben. Doch genau daran bastelt DFINITY bereits seit 2016.► Jetzt bei BTC-ECHO lesen!",technology,2021-05-11T13:30:47Z
BLICK,Drohnen: Absturz von Armeedrohne in Israel geklärt,Der Absturz einer für die Schweiz bestimmten Armeedrohne des Typs Hermes 900 HFE in Israel vom August 2020 ist auf unerwartet starke Schwingungen zurückzuführen. In der Folge habe sich das sogenannte V-Leitwerk vom Rumpf der Drohne gelöst und sie sei abgestürzt.,technology,2021-05-11T12:18:20Z
ecomento.de,"KÜS Trend-Tacho: ""Die Zukunft gehört dem Wasserstoff-Antrieb""","Laut dem ""Trend-Tacho"" der Prüforganisation KÜS halten die meisten Deutschen die Brennstoffzelle für die ökologisch sinnvollste Antriebsart.",technology,2021-05-11T10:30:00Z
BTC-ECHO | Bitcoin & Blockchain Pioneers,Shitstorm: Heftige Kritik nach Bitcoin-Beitrag der ARD,"Nachdem die ARD in ihrem Magazin ""Kontraste"" einen Beitrag zu Bitcoin sendete, hagelt es Kritik. Der Kernvorwurf: Aussagen wurden verdreht und aus dem Zusammenhang gerissen.",technology,2021-05-11T10:03:40Z
finews.ch,Fintech-Startup Kaspar& holt Ex-Twint-CEO,Das auf Anlagesparen ausgerichtete Fintech Kaspar& hat einen prominenten Verwaltungsrat geholt. Die Hypothekarbank Lenzburg übernimmt die Depotführung für das Startup.,technology,2021-05-11T09:23:00Z
BLICK,Internetkriminalität: 34 Vorfälle mit Verschlüsselungstrojanern,Unternehmen und Privatpersonen haben dem nationalen Zentrum für Cybersicherheit (NCSC) im zweiten Halbjahr 2020 über 5500 Cybervorfälle gemeldet. Den grössten Anteil machten Betrugsfälle aus. 34 Meldungen betrafen Vorfälle mit Verschlüsselungstrojanern.,technology,2021-05-11T08:57:19Z
finews.ch,"21Shares: ""Weltbeste Investorin"" steigt bei Schweizer Kryptofirma ein",The fund manager behind one of the hottest exchange-traded funds will help oversee a Swiss crypto provider which has mushroomed to $2 billion in the last year.,technology,2021-05-11T08:38:00Z
Coincierge,Jetzt Litecoin zu kaufen ist wie Ethereum kaufen bei $360,Litecoin hat ein neues Allzeithoch erreicht. Ein Analyst sieht einen Wendepunkt erreicht und erwartet weitere Aufwärtsbewegungen.,technology,2021-05-11T07:40:45Z
mobiFlip,Geräuscherkennung mit Android und iPhone nutzen,"Seitdem ich das Bose Noise Cancelling Headphones 700 nutze und damit meine Umgebung nahezu geräuschlos schalten kann, stand ich vor einem Problem: die Türklingel.",technology,2021-05-11T06:16:26Z
