source,title,description,category,publishedAt
20 Minuten,Seilbahn-Tragödie in Stresa IT,"In Stresa IT hat ein Seilbahnunglück 14 Todesopfer gefordert. Ob eine Seilbahn sicher ist, können Passagiere meist nicht erkennen, sagt der Seilbahningenieur Reto Canale.",technology,2021-05-24T19:44:52Z
BLICK,Nikki und Dan Phillippi bekommen Shitstorm wegen Adoptions-Video ab,"Nikki und Dan Phillippi werden erneut im Netz angefeindet. Die Youtuber mussten anfangs Mai einen Shitstorm über sich ergehen lassen, weil sie ihren Hund einschläferten. Nun folgt der nächste wegen eines alten Videos.",technology,2021-05-24T19:01:02Z
BLICK,Riesige Cupsieger-Party in Luzern: FCL-Fans ausser Rand und Band,In der Innerschweiz gibts kein Halten mehr: Die FCL-Fans lassen es nach dem Cupsieg krachen.,technology,2021-05-24T18:32:09Z
20 Minuten,Kritik an Erziehungsfähigkeit : Queen ist «zutiefst bestürzt» über Prinz Harrys Angriffe auf das Königshaus,In der Doku-Serie «The Me You Can’t See» sowie in einem Podcast-Interview holte Prinz Harry erneut zum Schlag gegen seine eigene Familie aus. Seine Grossmutter ist «not amused».,technology,2021-05-24T18:24:16Z
BLICK,Nach Pleiten gegen Dänemark und Belarus - was ist mit Schweden los?,"«Peinlich und schädlich fürs schwedische Hockey», lautet eine der Schelten in der Heimat des Weltmeisters von 2018. Der Knüller gegen die Schweiz ist nun bereits ein Schlüsselspiel. Die Schweden sind angeschlagen.",technology,2021-05-24T18:06:12Z
20 Minuten,Kulturelle Aneignung : Justin Bieber rasiert nach Dreadlocks-Kritik seinen Kopf,"Über Wochen hinweg wurde Bieber im Netz dazu aufgerufen, seine Dreadlocks loszuwerden. Nun hat er sich kurzerhand den Kopf kahl rasiert.",technology,2021-05-24T16:59:14Z
Schweizer Radio und Fernsehen (SRF),Tunnelsperrung nach Auto-Brand - Gotthard-Tunnel wieder offen - immer noch mehrere Kilometer Stau,Die Sperrung des Tunnels wegen eines rauchenden Fahrzeugs ist aufgehoben. Autos stauen sich nach wie vor auf der A2.,technology,2021-05-24T14:43:00Z
BLICK,Blick erklärt den Krypto-Crash - 1 Billion Dollar in 1 Woche weg,Crash im Krypto-Markt! Bitcoin und Co. haben eine rabenschwarze Woche hinter sich. Aussagen aus China und Amerika machten den Handel mit Digitalwährungen noch verrückter und volatiler. Blick erklärt die Hintergründe.,technology,2021-05-24T14:34:54Z
play3.de,Star Wars Jedi Fallen Order: Möglicher Termin für die PS5-Version aufgetaucht,"Ende des vergangenen Monats bestätigte Electronic Arts die Gerüchte um einen Next-Gen-Release und kündigte ""Star Wars: Jedi Fallen Order""",technology,2021-05-24T14:33:00Z
Schweizer Radio und Fernsehen (SRF),Verkürzte Königsetappe am Giro - Bernal triumphiert solo und greift nach dem Gesamtsieg,Egan Bernal siegt auf der verkürzten Königsetappe des Giro überlegen und sorgt wohl für die Vorentscheidung.,technology,2021-05-24T14:24:00Z
"CryptoTicker.io - Bitcoin Kurs, Ethereum Kurs & Crypto News",Kryptomarkt im Überblick - Werden wir noch weiter fallen?,Der Kryptomarkt ist seit einigen Tagen stark am fallen. Doch wie weit könnte es noch nach unten gehen? Wir klären euch auf.,technology,2021-05-24T18:58:00Z
BTC-ECHO | Bitcoin & Blockchain Pioneers,Bitcoin zieht Altcoins mit: Darauf kommt es bei der Aufholjagd jetzt an,Bitcoin rutscht kurzfristig auf 30.000 USD und zieht die Altcoins mit gen Süden. Erst in den letzten 18 Stunden kommt es zu einer Erholung.,technology,2021-05-24T14:02:23Z
ChinaHandys.net,Xiaomi Mi Portable Bluetooth Speaker (16W) im Test,Hier: ✅ Der Xiaomi Mi Portable Bluetooth Speaker ist ein tragbarer und wasserdichter Lautsprecher für unterwegs. Hier im Test ➜ Jetzt lesen!,technology,2021-05-24T13:14:28Z
 Cash,"Startup-Szene - Startups: Das sind die wertvollsten ""Einhörner"" der Welt",682 Startups werden weltweit mit über einer Milliarde Dollar bewertet. Auch in der Schweiz sind die «Unicorns» anzutreffen.,technology,2021-05-24T10:08:00Z
inside digital,Wähle die besten Technik-Produkte für unterwegs,Es ist Halbzeit: Unsere große Leserwahl 2021 ist bereits in vollem Gange. Gehe noch heute ins virtuelle Wahllokal und stimme ab!,technology,2021-05-24T10:00:00Z
CHIP Online Deutschland,WhatsApp-Aussteiger: Gratis-App macht Umstieg leicht,"Wenn man einen Messenger wie WhatsApp lange Zeit genutzt hat, kann es viel Aufwand nach sich ziehen, alle Kontakte über den Umzug zu einer sicheren Alternative wie Signal oder Threema zu informieren. Doch es gibt praktische Apps, die das dank automatischer Antworten erleichtern – wir zeigen, wie Sie diese sonst noch praktisch einsetzen können.",technology,2021-05-24T09:09:07Z
Blockchain-Hero,Diese 4 Signale deuten auf einen lokalen Bitcoin (BTC) Boden hin,"4 Gründe, warum der Bitcoin-Absturz bald einen lokalen Tiefpunkt erreicht haben könnte, die der Markt allerdings nicht zu beobachten scheint.",technology,2021-05-24T08:17:46Z
cash.ch,Digitalgeld - Mining: Kryptowährungs-Firmen stellen Geschäfte in China ein - Kurse von Bitcoin und Ether stabilisieren sich,"Chinas massives Vorgehen gegen die Kryptowährungsindustrie zeigt Wirkung: Mehrere Firmen der Branche kündigten am Montag an, ihr Geschäft in der Volksrepublik einzustellen.",technology,2021-05-24T07:54:00Z
CHIP Online Deutschland,Microsoft: Windows-10-Taskleiste bekommt Update,"Microsoft bringt eine neu aufgefrischte Taskleiste in Windows 10. Ein neues Modul bringt Nachrichten- und Wetter-Infos direkt in die Windows-Taskleiste. Doch die neue Funktion ist nicht nur für kommende Windows-Versionen geplant, Microsoft reicht sie per Update an alle unterstützten Windows-10-Versionen weiter.",technology,2021-05-24T07:08:05Z
"CryptoTicker.io - Bitcoin Kurs, Ethereum Kurs & Crypto News",Bitcoin Crash - Außergewöhnliches Ereignis oder doch relative Normalität?,Der Bitcoin Crash bedeutet einen enormen Wertverlust. Doch die Zahlen müssen in Relation gesetzt werden. Ist der Crash eine Anomalie?,technology,2021-05-24T06:39:00Z
